[{
  "_id": {
    "$oid": "678c331e86ed4bbab48746fa"
  },
  "text": "This message couldn't be displayed on your device due to copyright infringement.",
  "timestamp": 1689577923,
  "posted_str_date": "07/17/2023",
  "forward_from_user_username": null,
  "forward_from_chat_username": null,
  "posted": {
    "$date": "2023-07-17T14:12:03.000Z"
  },
  "market_entities": {
    "dxy": {
      "name": "dxy",
      "description": "usd index",
      "Open": 99.96,
      "Close": 99.84,
      "Low": 99.75,
      "High": 100.18,
      "200MA": 104.30464999999998,
      "AboveMA": 0,
      "AboveMADays": 163,
      "RSI": 26.79817244260714
    },
    "gold": {
      "name": "gold",
      "description": "gold infinite future price",
      "Open": 1977.2,
      "Close": 1975.5,
      "Low": 1968.5,
      "High": 1982.5,
      "200MA": 1896.343,
      "AboveMA": 1,
      "AboveMADays": 156,
      "RSI": 53.566836673219015
    },
    "btc": {
      "name": "btc",
      "description": "bitcoin price",
      "Open": 30235.5,
      "Close": 30139.7,
      "Low": 29693.3,
      "High": 30335.9,
      "200MA": 25793.672,
      "AboveMA": 1,
      "AboveMADays": 186,
      "RSI": 52.199610071345695
    },
    "RUB": {
      "name": "btc",
      "description": "ruble quote",
      "Open": 90.06,
      "Close": 91,
      "Low": 90.06,
      "High": 91.0775,
      "200MA": 73.350468,
      "AboveMA": 1,
      "AboveMADays": 145,
      "RSI": 68.95476109688347
    },
    "BR": {
      "name": "btc",
      "description": "brent oil price",
      "Open": 79.2,
      "Close": 78.38,
      "Low": 78.12,
      "High": 80.36,
      "200MA": 82.09819999999999,
      "AboveMA": 0,
      "AboveMADays": 227,
      "RSI": 55.028022259906784
    }
  },
  "views": null,
  "msg_id": 951,
  "forwards": null,
  "outgoing": false,
  "media": "None",
  "reactions": [],
  "edit_date": null,
  "mentioned": false,
  "scheduled": false,
  "from_scheduled": false,
  "hashtags": [],
  "entities": [
    {
      "type": "MessageEntityType.ITALIC",
      "offset": 0,
      "length": 80
    }
  ],
  "mentions": [],
  "tg_urls": [],
  "symbols": 80,
  "words": 12,
  "new_timestamp": 1689577923,
  "outlier": 0
},
{
  "_id": {
    "$oid": "678c331f86ed4bbab48746fb"
  },
  "text": "This message couldn't be displayed on your device due to copyright infringement.",
  "timestamp": 1689320750,
  "posted_str_date": "07/14/2023",
  "forward_from_user_username": null,
  "forward_from_chat_username": null,
  "posted": {
    "$date": "2023-07-14T14:45:50.000Z"
  },
  "market_entities": {
    "dxy": {
      "name": "dxy",
      "description": "usd index",
      "Open": 99.75,
      "Close": 99.91,
      "Low": 99.58,
      "High": 100.01,
      "200MA": 104.37115,
      "AboveMA": 0,
      "AboveMADays": 162,
      "RSI": 27.16580142531421
    },
    "gold": {
      "name": "gold",
      "description": "gold infinite future price",
      "Open": 1984.4,
      "Close": 1983.4,
      "Low": 1974.5,
      "High": 1986.7,
      "200MA": 1895.1365,
      "AboveMA": 1,
      "AboveMADays": 155,
      "RSI": 56.70580000915998
    },
    "btc": {
      "name": "btc",
      "description": "bitcoin price",
      "Open": 31465.4,
      "Close": 30317.4,
      "Low": 29944.3,
      "High": 31602.6,
      "200MA": 25589.7825,
      "AboveMA": 1,
      "AboveMADays": 183,
      "RSI": 53.98543075632055
    },
    "RUB": {
      "name": "btc",
      "description": "ruble quote",
      "Open": 90.1125,
      "Close": 90.06,
      "Low": 89.724,
      "High": 90.4033,
      "200MA": 73.181518,
      "AboveMA": 1,
      "AboveMADays": 144,
      "RSI": 65.66720004816926
    },
    "BR": {
      "name": "btc",
      "description": "brent oil price",
      "Open": 81.27,
      "Close": 79.6,
      "Low": 79.26,
      "High": 81.31,
      "200MA": 82.16435000000001,
      "AboveMA": 0,
      "AboveMADays": 226,
      "RSI": 59.55385585417224
    }
  },
  "views": null,
  "msg_id": 950,
  "forwards": null,
  "outgoing": false,
  "media": "None",
  "reactions": [],
  "edit_date": null,
  "mentioned": false,
  "scheduled": false,
  "from_scheduled": false,
  "hashtags": [],
  "entities": [
    {
      "type": "MessageEntityType.ITALIC",
      "offset": 0,
      "length": 80
    }
  ],
  "mentions": [],
  "tg_urls": [],
  "symbols": 80,
  "words": 12,
  "new_timestamp": 1689320750,
  "outlier": 0
},
{
  "_id": {
    "$oid": "678c331f86ed4bbab48746fc"
  },
  "text": "This message couldn't be displayed on your device due to copyright infringement.",
  "timestamp": 1689059020,
  "posted_str_date": "07/11/2023",
  "forward_from_user_username": null,
  "forward_from_chat_username": null,
  "posted": {
    "$date": "2023-07-11T14:03:40.000Z"
  },
  "market_entities": {
    "dxy": {
      "name": "dxy",
      "description": "usd index",
      "Open": 101.94,
      "Close": 101.73,
      "Low": 101.65,
      "High": 101.97,
      "200MA": 104.55075,
      "AboveMA": 0,
      "AboveMADays": 159,
      "RSI": 37.417752821053696
    },
    "gold": {
      "name": "gold",
      "description": "gold infinite future price",
      "Open": 1949.8,
      "Close": 1956.2,
      "Low": 1949.8,
      "High": 1963.5,
      "200MA": 1891.1185,
      "AboveMA": 1,
      "AboveMADays": 152,
      "RSI": 48.27621993690812
    },
    "btc": {
      "name": "btc",
      "description": "bitcoin price",
      "Open": 30414.2,
      "Close": 30623.3,
      "Low": 30333.8,
      "High": 30782.2,
      "200MA": 25381.864000000005,
      "AboveMA": 1,
      "AboveMADays": 180,
      "RSI": 60.960845205023794
    },
    "RUB": {
      "name": "btc",
      "description": "ruble quote",
      "Open": 90.415,
      "Close": 90.3825,
      "Low": 89.8354,
      "High": 91.0245,
      "200MA": 72.6982555,
      "AboveMA": 1,
      "AboveMADays": 141,
      "RSI": 69.87835161476654
    },
    "BR": {
      "name": "btc",
      "description": "brent oil price",
      "Open": 77.49,
      "Close": 79.07,
      "Low": 77.37,
      "High": 79.17,
      "200MA": 82.27195,
      "AboveMA": 0,
      "AboveMADays": 223,
      "RSI": 60.53456950124789
    }
  },
  "views": null,
  "msg_id": 949,
  "forwards": null,
  "outgoing": false,
  "media": "None",
  "reactions": [],
  "edit_date": null,
  "mentioned": false,
  "scheduled": false,
  "from_scheduled": false,
  "hashtags": [],
  "entities": [
    {
      "type": "MessageEntityType.ITALIC",
      "offset": 0,
      "length": 80
    }
  ],
  "mentions": [],
  "tg_urls": [],
  "symbols": 80,
  "words": 12,
  "new_timestamp": 1689059020,
  "outlier": 0
},
{
  "_id": {
    "$oid": "678c331f86ed4bbab48746fd"
  },
  "text": "This message couldn't be displayed on your device due to copyright infringement.",
  "timestamp": 1688805293,
  "posted_str_date": "07/08/2023",
  "forward_from_user_username": null,
  "forward_from_chat_username": null,
  "posted": {
    "$date": "2023-07-08T15:34:53.000Z"
  },
  "market_entities": {
    "dxy": {
      "name": "dxy",
      "description": "usd index",
      "Open": 103.08,
      "Close": 102.27,
      "Low": 102.23,
      "High": 103.19,
      "200MA": 104.64135,
      "AboveMA": 0,
      "AboveMADays": 157,
      "RSI": 42.272386355168805
    },
    "gold": {
      "name": "gold",
      "description": "gold infinite future price",
      "Open": 1936.7,
      "Close": 1951.6,
      "Low": 1934.7,
      "High": 1960,
      "200MA": 1888.345,
      "AboveMA": 1,
      "AboveMADays": 150,
      "RSI": 46.55553382945334
    },
    "btc": {
      "name": "btc",
      "description": "bitcoin price",
      "Open": 30346.8,
      "Close": 30288.8,
      "Low": 30055.9,
      "High": 30379.9,
      "200MA": 25177.994,
      "AboveMA": 1,
      "AboveMADays": 177,
      "RSI": 58.452961705398366
    },
    "RUB": {
      "name": "btc",
      "description": "ruble quote",
      "Open": 92.2975,
      "Close": 91.25,
      "Low": 90.9548,
      "High": 92.2975,
      "200MA": 72.378068,
      "AboveMA": 1,
      "AboveMADays": 139,
      "RSI": 75.72402858466839
    },
    "BR": {
      "name": "btc",
      "description": "brent oil price",
      "Open": 76.22,
      "Close": 78.08,
      "Low": 75.75,
      "High": 78.15,
      "200MA": 82.36574999999999,
      "AboveMA": 0,
      "AboveMADays": 221,
      "RSI": 58.52078803019076
    }
  },
  "views": null,
  "msg_id": 948,
  "forwards": null,
  "outgoing": false,
  "media": "None",
  "reactions": [],
  "edit_date": null,
  "mentioned": false,
  "scheduled": false,
  "from_scheduled": false,
  "hashtags": [],
  "entities": [
    {
      "type": "MessageEntityType.ITALIC",
      "offset": 0,
      "length": 80
    }
  ],
  "mentions": [],
  "tg_urls": [],
  "symbols": 80,
  "words": 12,
  "new_timestamp": 1688805293,
  "outlier": 0
},
{
  "_id": {
    "$oid": "678c331f86ed4bbab48746fe"
  },
  "text": "This message couldn't be displayed on your device due to copyright infringement.",
  "timestamp": 1688531787,
  "posted_str_date": "07/05/2023",
  "forward_from_user_username": null,
  "forward_from_chat_username": null,
  "posted": {
    "$date": "2023-07-05T11:36:27.000Z"
  },
  "market_entities": {
    "dxy": {
      "name": "dxy",
      "description": "usd index",
      "Open": 103.08,
      "Close": 103.37,
      "Low": 102.96,
      "High": 103.39,
      "200MA": 104.7365,
      "AboveMA": 0,
      "AboveMADays": 155,
      "RSI": 55.090588698040136
    },
    "gold": {
      "name": "gold",
      "description": "gold infinite future price",
      "Open": 1948,
      "Close": 1946.2,
      "Low": 1942,
      "High": 1961.5,
      "200MA": 1885.262,
      "AboveMA": 1,
      "AboveMADays": 148,
      "RSI": 43.63876801728135
    },
    "btc": {
      "name": "btc",
      "description": "bitcoin price",
      "Open": 30768.6,
      "Close": 30512.8,
      "Low": 30233.3,
      "High": 30875.6,
      "200MA": 24975.678499999995,
      "AboveMA": 1,
      "AboveMADays": 174,
      "RSI": 62.32318370515745
    },
    "RUB": {
      "name": "btc",
      "description": "ruble quote",
      "Open": 89.18,
      "Close": 91,
      "Low": 89.18,
      "High": 91.1715,
      "200MA": 72.06678050000001,
      "AboveMA": 1,
      "AboveMADays": 137,
      "RSI": 81.3202970083728
    },
    "BR": {
      "name": "btc",
      "description": "brent oil price",
      "Open": 75.83,
      "Close": 76.41,
      "Low": 75.13,
      "High": 76.7,
      "200MA": 82.4329,
      "AboveMA": 0,
      "AboveMADays": 219,
      "RSI": 53.71559423824641
    }
  },
  "views": null,
  "msg_id": 947,
  "forwards": null,
  "outgoing": false,
  "media": "None",
  "reactions": [],
  "edit_date": null,
  "mentioned": false,
  "scheduled": false,
  "from_scheduled": false,
  "hashtags": [],
  "entities": [
    {
      "type": "MessageEntityType.ITALIC",
      "offset": 0,
      "length": 80
    }
  ],
  "mentions": [],
  "tg_urls": [],
  "symbols": 80,
  "words": 12,
  "new_timestamp": 1688531787,
  "outlier": 0
},
{
  "_id": {
    "$oid": "678c331f86ed4bbab48746ff"
  },
  "text": "This message couldn't be displayed on your device due to copyright infringement.",
  "timestamp": 1688276181,
  "posted_str_date": "07/02/2023",
  "forward_from_user_username": null,
  "forward_from_chat_username": null,
  "posted": {
    "$date": "2023-07-02T12:36:21.000Z"
  },
  "market_entities": {
    "dxy": {
      "name": "dxy",
      "description": "usd index",
      "Open": 103.35,
      "Close": 102.91,
      "Low": 102.75,
      "High": 103.54,
      "200MA": 104.8937,
      "AboveMA": 0,
      "AboveMADays": 152,
      "RSI": 49.62748120874788
    },
    "gold": {
      "name": "gold",
      "description": "gold infinite future price",
      "Open": 1935.6,
      "Close": 1948.5,
      "Low": 1927.8,
      "High": 1949.7,
      "200MA": 1881.2145,
      "AboveMA": 1,
      "AboveMADays": 145,
      "RSI": 41.92632518559228
    },
    "btc": {
      "name": "btc",
      "description": "bitcoin price",
      "Open": 30587.1,
      "Close": 30617.7,
      "Low": 30227.9,
      "High": 30769,
      "200MA": 24767.33,
      "AboveMA": 1,
      "AboveMADays": 171,
      "RSI": 67.0671463300881
    },
    "RUB": {
      "name": "btc",
      "description": "ruble quote",
      "Open": 87.57,
      "Close": 89.55,
      "Low": 87.3867,
      "High": 89.6863,
      "200MA": 71.62355550000001,
      "AboveMA": 1,
      "AboveMADays": 134,
      "RSI": 83.66192748892664
    },
    "BR": {
      "name": "btc",
      "description": "brent oil price",
      "Open": 74.33,
      "Close": 75.41,
      "Low": 74.28,
      "High": 75.84,
      "200MA": 82.61505,
      "AboveMA": 0,
      "AboveMADays": 216,
      "RSI": 50.67430084174903
    }
  },
  "views": null,
  "msg_id": 946,
  "forwards": null,
  "outgoing": false,
  "media": "None",
  "reactions": [],
  "edit_date": null,
  "mentioned": false,
  "scheduled": false,
  "from_scheduled": false,
  "hashtags": [],
  "entities": [
    {
      "type": "MessageEntityType.ITALIC",
      "offset": 0,
      "length": 80
    }
  ],
  "mentions": [],
  "tg_urls": [],
  "symbols": 80,
  "words": 12,
  "new_timestamp": 1688276181,
  "outlier": 0
},
{
  "_id": {
    "$oid": "678c331f86ed4bbab4874700"
  },
  "text": "This message couldn't be displayed on your device due to copyright infringement.",
  "timestamp": 1688022272,
  "posted_str_date": "06/29/2023",
  "forward_from_user_username": null,
  "forward_from_chat_username": null,
  "posted": {
    "$date": "2023-06-29T14:04:32.000Z"
  },
  "market_entities": {
    "dxy": {
      "name": "dxy",
      "description": "usd index",
      "Open": 102.96,
      "Close": 103.34,
      "Low": 102.78,
      "High": 103.44,
      "200MA": 104.9451,
      "AboveMA": 0,
      "AboveMADays": 151,
      "RSI": 54.75290729145861
    },
    "gold": {
      "name": "gold",
      "description": "gold infinite future price",
      "Open": 1935.5,
      "Close": 1936.8,
      "Low": 1919.6,
      "High": 1940,
      "200MA": 1879.8275,
      "AboveMA": 1,
      "AboveMADays": 144,
      "RSI": 37.12678251431416
    },
    "btc": {
      "name": "btc",
      "description": "bitcoin price",
      "Open": 30077.3,
      "Close": 30445.7,
      "Low": 30051.3,
      "High": 30823.1,
      "200MA": 24572.87,
      "AboveMA": 1,
      "AboveMADays": 168,
      "RSI": 66.07295246456255
    },
    "RUB": {
      "name": "btc",
      "description": "ruble quote",
      "Open": 86.3725,
      "Close": 87.57,
      "Low": 86.1084,
      "High": 87.57,
      "200MA": 71.4752305,
      "AboveMA": 1,
      "AboveMADays": 133,
      "RSI": 79.19095144302717
    },
    "BR": {
      "name": "btc",
      "description": "brent oil price",
      "Open": 73.95,
      "Close": 74.51,
      "Low": 73.57,
      "High": 75.15,
      "200MA": 82.685,
      "AboveMA": 0,
      "AboveMADays": 215,
      "RSI": 47.891099417510354
    }
  },
  "views": null,
  "msg_id": 945,
  "forwards": null,
  "outgoing": false,
  "media": "None",
  "reactions": [],
  "edit_date": null,
  "mentioned": false,
  "scheduled": false,
  "from_scheduled": false,
  "hashtags": [],
  "entities": [
    {
      "type": "MessageEntityType.ITALIC",
      "offset": 0,
      "length": 80
    }
  ],
  "mentions": [],
  "tg_urls": [],
  "symbols": 80,
  "words": 12,
  "new_timestamp": 1688022272,
  "outlier": 0
},
{
  "_id": {
    "$oid": "678c331f86ed4bbab4874701"
  },
  "text": "This message couldn't be displayed on your device due to copyright infringement.",
  "timestamp": 1687757173,
  "posted_str_date": "06/26/2023",
  "forward_from_user_username": null,
  "forward_from_chat_username": null,
  "posted": {
    "$date": "2023-06-26T12:26:13.000Z"
  },
  "market_entities": {
    "dxy": {
      "name": "dxy",
      "description": "usd index",
      "Open": 102.87,
      "Close": 102.69,
      "Low": 102.61,
      "High": 102.83,
      "200MA": 105.06244999999998,
      "AboveMA": 0,
      "AboveMADays": 148,
      "RSI": 46.81942040718639
    },
    "gold": {
      "name": "gold",
      "description": "gold infinite future price",
      "Open": 1952.8,
      "Close": 1953.1,
      "Low": 1950.6,
      "High": 1962,
      "200MA": 1875.917,
      "AboveMA": 1,
      "AboveMADays": 141,
      "RSI": 41.11458032643039
    },
    "btc": {
      "name": "btc",
      "description": "bitcoin price",
      "Open": 30466.3,
      "Close": 30267,
      "Low": 29986.3,
      "High": 30645.9,
      "200MA": 24373.534,
      "AboveMA": 1,
      "AboveMADays": 165,
      "RSI": 68.44857522563946
    },
    "RUB": {
      "name": "btc",
      "description": "ruble quote",
      "Open": 84.7,
      "Close": 85.0875,
      "Low": 84.2534,
      "High": 86.7665,
      "200MA": 71.083918,
      "AboveMA": 1,
      "AboveMADays": 130,
      "RSI": 70.14725579965241
    },
    "BR": {
      "name": "btc",
      "description": "brent oil price",
      "Open": 74.6,
      "Close": 74.35,
      "Low": 73.61,
      "High": 75,
      "200MA": 82.9303,
      "AboveMA": 0,
      "AboveMADays": 212,
      "RSI": 46.3016772162625
    }
  },
  "views": null,
  "msg_id": 944,
  "forwards": null,
  "outgoing": false,
  "media": "None",
  "reactions": [],
  "edit_date": null,
  "mentioned": false,
  "scheduled": false,
  "from_scheduled": false,
  "hashtags": [],
  "entities": [
    {
      "type": "MessageEntityType.ITALIC",
      "offset": 0,
      "length": 80
    }
  ],
  "mentions": [],
  "tg_urls": [],
  "symbols": 80,
  "words": 12,
  "new_timestamp": 1687757173,
  "outlier": 0
},
{
  "_id": {
    "$oid": "678c331f86ed4bbab4874702"
  },
  "text": "This message couldn't be displayed on your device due to copyright infringement.",
  "timestamp": 1687492057,
  "posted_str_date": "06/23/2023",
  "forward_from_user_username": null,
  "forward_from_chat_username": null,
  "posted": {
    "$date": "2023-06-23T10:47:37.000Z"
  },
  "market_entities": {
    "dxy": {
      "name": "dxy",
      "description": "usd index",
      "Open": 102.38,
      "Close": 102.9,
      "Low": 102.38,
      "High": 103.17,
      "200MA": 105.0977,
      "AboveMA": 0,
      "AboveMADays": 147,
      "RSI": 49.18876128886085
    },
    "gold": {
      "name": "gold",
      "description": "gold infinite future price",
      "Open": 1942.8,
      "Close": 1948.9,
      "Low": 1939.1,
      "High": 1967.1,
      "200MA": 1874.697,
      "AboveMA": 1,
      "AboveMADays": 140,
      "RSI": 39.64022764226454
    },
    "btc": {
      "name": "btc",
      "description": "bitcoin price",
      "Open": 29890.2,
      "Close": 30679.4,
      "Low": 29822.6,
      "High": 31395.4,
      "200MA": 24172.955500000004,
      "AboveMA": 1,
      "AboveMADays": 162,
      "RSI": 72.68136278947028
    },
    "RUB": {
      "name": "btc",
      "description": "ruble quote",
      "Open": 84.05,
      "Close": 84.7,
      "Low": 83.6478,
      "High": 84.8393,
      "200MA": 70.9621305,
      "AboveMA": 1,
      "AboveMADays": 129,
      "RSI": 68.31021588588597
    },
    "BR": {
      "name": "btc",
      "description": "brent oil price",
      "Open": 74.22,
      "Close": 74.01,
      "Low": 72.3,
      "High": 74.55,
      "200MA": 83.02414999999999,
      "AboveMA": 0,
      "AboveMADays": 211,
      "RSI": 45.21420858985907
    }
  },
  "views": null,
  "msg_id": 943,
  "forwards": null,
  "outgoing": false,
  "media": "None",
  "reactions": [],
  "edit_date": null,
  "mentioned": false,
  "scheduled": false,
  "from_scheduled": false,
  "hashtags": [],
  "entities": [
    {
      "type": "MessageEntityType.ITALIC",
      "offset": 0,
      "length": 80
    }
  ],
  "mentions": [],
  "tg_urls": [],
  "symbols": 80,
  "words": 12,
  "new_timestamp": 1687492057,
  "outlier": 0
},
{
  "_id": {
    "$oid": "678c331f86ed4bbab4874703"
  },
  "text": "This message couldn't be displayed on your device due to copyright infringement.",
  "timestamp": 1687236609,
  "posted_str_date": "06/20/2023",
  "forward_from_user_username": null,
  "forward_from_chat_username": null,
  "posted": {
    "$date": "2023-06-20T11:50:09.000Z"
  },
  "market_entities": {
    "dxy": {
      "name": "dxy",
      "description": "usd index",
      "Open": 102.48,
      "Close": 102.54,
      "Low": 102.32,
      "High": 102.79,
      "200MA": 105.2067,
      "AboveMA": 0,
      "AboveMADays": 144,
      "RSI": 42.71623033623241
    },
    "gold": {
      "name": "gold",
      "description": "gold infinite future price",
      "Open": 1989.4,
      "Close": 1967.2,
      "Low": 1960.4,
      "High": 1990.8,
      "200MA": 1871.3485,
      "AboveMA": 1,
      "AboveMADays": 137,
      "RSI": 43.09864204303224
    },
    "btc": {
      "name": "btc",
      "description": "bitcoin price",
      "Open": 26845.9,
      "Close": 28307.7,
      "Low": 26665.5,
      "High": 28393,
      "200MA": 23974.9395,
      "AboveMA": 1,
      "AboveMADays": 159,
      "RSI": 62.79977643005237
    },
    "RUB": {
      "name": "btc",
      "description": "ruble quote",
      "Open": 84.1425,
      "Close": 84.785,
      "Low": 84.0432,
      "High": 84.785,
      "200MA": 70.61295550000001,
      "AboveMA": 1,
      "AboveMADays": 126,
      "RSI": 72.91834501052402
    },
    "BR": {
      "name": "btc",
      "description": "brent oil price",
      "Open": 76.08,
      "Close": 75.89,
      "Low": 74.53,
      "High": 77.08,
      "200MA": 83.28094999999999,
      "AboveMA": 0,
      "AboveMADays": 208,
      "RSI": 50.43465997017141
    }
  },
  "views": null,
  "msg_id": 942,
  "forwards": null,
  "outgoing": false,
  "media": "None",
  "reactions": [],
  "edit_date": null,
  "mentioned": false,
  "scheduled": false,
  "from_scheduled": false,
  "hashtags": [],
  "entities": [
    {
      "type": "MessageEntityType.ITALIC",
      "offset": 0,
      "length": 80
    }
  ],
  "mentions": [],
  "tg_urls": [],
  "symbols": 80,
  "words": 12,
  "new_timestamp": 1687236609,
  "outlier": 0
},
{
  "_id": {
    "$oid": "678c331f86ed4bbab4874704"
  },
  "text": "This message couldn't be displayed on your device due to copyright infringement.",
  "timestamp": 1686985016,
  "posted_str_date": "06/17/2023",
  "forward_from_user_username": null,
  "forward_from_chat_username": null,
  "posted": {
    "$date": "2023-06-17T13:56:56.000Z"
  },
  "market_entities": {
    "dxy": {
      "name": "dxy",
      "description": "usd index",
      "Open": 102.12,
      "Close": 102.24,
      "Low": 102.01,
      "High": 102.43,
      "200MA": 105.27215,
      "AboveMA": 0,
      "AboveMADays": 142,
      "RSI": 38.48118481772609
    },
    "gold": {
      "name": "gold",
      "description": "gold infinite future price",
      "Open": 1989.2,
      "Close": 1990.7,
      "Low": 1985,
      "High": 1999.5,
      "200MA": 1869.014,
      "AboveMA": 1,
      "AboveMADays": 135,
      "RSI": 47.765094288398174
    },
    "btc": {
      "name": "btc",
      "description": "bitcoin price",
      "Open": 26341.3,
      "Close": 26515,
      "Low": 26183.5,
      "High": 26767.3,
      "200MA": 23823.6205,
      "AboveMA": 1,
      "AboveMADays": 156,
      "RSI": 49.70335861064366
    },
    "RUB": {
      "name": "btc",
      "description": "ruble quote",
      "Open": 83.75,
      "Close": 84.1375,
      "Low": 83.4838,
      "High": 84.2392,
      "200MA": 70.37276800000001,
      "AboveMA": 1,
      "AboveMADays": 124,
      "RSI": 70.0276385609864
    },
    "BR": {
      "name": "btc",
      "description": "brent oil price",
      "Open": 75.64,
      "Close": 76.58,
      "Low": 75.14,
      "High": 76.7,
      "200MA": 83.39849999999998,
      "AboveMA": 0,
      "AboveMADays": 206,
      "RSI": 52.3803840561299
    }
  },
  "views": null,
  "msg_id": 941,
  "forwards": null,
  "outgoing": false,
  "media": "None",
  "reactions": [],
  "edit_date": null,
  "mentioned": false,
  "scheduled": false,
  "from_scheduled": false,
  "hashtags": [],
  "entities": [
    {
      "type": "MessageEntityType.ITALIC",
      "offset": 0,
      "length": 80
    }
  ],
  "mentions": [],
  "tg_urls": [],
  "symbols": 80,
  "words": 12,
  "new_timestamp": 1686985016,
  "outlier": 0
},
{
  "_id": {
    "$oid": "678c331f86ed4bbab4874705"
  },
  "text": "This message couldn't be displayed on your device due to copyright infringement.",
  "timestamp": 1686719883,
  "posted_str_date": "06/14/2023",
  "forward_from_user_username": null,
  "forward_from_chat_username": null,
  "posted": {
    "$date": "2023-06-14T12:18:03.000Z"
  },
  "market_entities": {
    "dxy": {
      "name": "dxy",
      "description": "usd index",
      "Open": 103.32,
      "Close": 102.95,
      "Low": 102.66,
      "High": 103.4,
      "200MA": 105.34395,
      "AboveMA": 0,
      "AboveMADays": 140,
      "RSI": 44.80381883233513
    },
    "gold": {
      "name": "gold",
      "description": "gold infinite future price",
      "Open": 1975.7,
      "Close": 1988.3,
      "Low": 1972.3,
      "High": 1993,
      "200MA": 1866.2385,
      "AboveMA": 1,
      "AboveMADays": 133,
      "RSI": 46.97481043738627
    },
    "btc": {
      "name": "btc",
      "description": "bitcoin price",
      "Open": 25929,
      "Close": 25129.5,
      "Low": 24847.4,
      "High": 26051.7,
      "200MA": 23676.771,
      "AboveMA": 1,
      "AboveMADays": 153,
      "RSI": 36.07270171342118
    },
    "RUB": {
      "name": "btc",
      "description": "ruble quote",
      "Open": 84.3,
      "Close": 84.165,
      "Low": 83.785,
      "High": 85.019,
      "200MA": 70.1341805,
      "AboveMA": 1,
      "AboveMADays": 122,
      "RSI": 72.48370595730282
    },
    "BR": {
      "name": "btc",
      "description": "brent oil price",
      "Open": 74,
      "Close": 73.17,
      "Low": 73.01,
      "High": 75.37,
      "200MA": 83.56915000000001,
      "AboveMA": 0,
      "AboveMADays": 204,
      "RSI": 42.99199646217657
    }
  },
  "views": null,
  "msg_id": 940,
  "forwards": null,
  "outgoing": false,
  "media": "None",
  "reactions": [],
  "edit_date": null,
  "mentioned": false,
  "scheduled": false,
  "from_scheduled": false,
  "hashtags": [],
  "entities": [
    {
      "type": "MessageEntityType.ITALIC",
      "offset": 0,
      "length": 80
    }
  ],
  "mentions": [],
  "tg_urls": [],
  "symbols": 80,
  "words": 12,
  "new_timestamp": 1686719883,
  "outlier": 0
},
{
  "_id": {
    "$oid": "678c331f86ed4bbab4874706"
  },
  "text": "This message couldn't be displayed on your device due to copyright infringement.",
  "timestamp": 1686453912,
  "posted_str_date": "06/11/2023",
  "forward_from_user_username": null,
  "forward_from_chat_username": null,
  "posted": {
    "$date": "2023-06-11T10:25:12.000Z"
  },
  "market_entities": {
    "dxy": {
      "name": "dxy",
      "description": "usd index",
      "Open": 103.3,
      "Close": 103.56,
      "Low": 103.29,
      "High": 103.61,
      "200MA": 105.44365,
      "AboveMA": 0,
      "AboveMADays": 137,
      "RSI": 52.74928187729498
    },
    "gold": {
      "name": "gold",
      "description": "gold infinite future price",
      "Open": 2000.2,
      "Close": 1996.8,
      "Low": 1990.6,
      "High": 2006.4,
      "200MA": 1862.2505,
      "AboveMA": 1,
      "AboveMADays": 130,
      "RSI": 48.69120361243546
    },
    "btc": {
      "name": "btc",
      "description": "bitcoin price",
      "Open": 25843.3,
      "Close": 25928.4,
      "Low": 25660.8,
      "High": 26190.1,
      "200MA": 23539.7925,
      "AboveMA": 1,
      "AboveMADays": 150,
      "RSI": 41.70320871277161
    },
    "RUB": {
      "name": "btc",
      "description": "ruble quote",
      "Open": 82.5975,
      "Close": 82.635,
      "Low": 82.265,
      "High": 83.024,
      "200MA": 69.896343,
      "AboveMA": 1,
      "AboveMADays": 120,
      "RSI": 66.61049872296473
    },
    "BR": {
      "name": "btc",
      "description": "brent oil price",
      "Open": 75.43,
      "Close": 74.74,
      "Low": 74.67,
      "High": 76.46,
      "200MA": 83.867,
      "AboveMA": 0,
      "AboveMADays": 201,
      "RSI": 44.98940248098769
    }
  },
  "views": null,
  "msg_id": 939,
  "forwards": null,
  "outgoing": false,
  "media": "None",
  "reactions": [],
  "edit_date": null,
  "mentioned": false,
  "scheduled": false,
  "from_scheduled": false,
  "hashtags": [],
  "entities": [
    {
      "type": "MessageEntityType.ITALIC",
      "offset": 0,
      "length": 80
    }
  ],
  "mentions": [],
  "tg_urls": [],
  "symbols": 80,
  "words": 12,
  "new_timestamp": 1686453912,
  "outlier": 0
},
{
  "_id": {
    "$oid": "678c331f86ed4bbab4874707"
  },
  "text": "This message couldn't be displayed on your device due to copyright infringement.",
  "timestamp": 1686193380,
  "posted_str_date": "06/08/2023",
  "forward_from_user_username": null,
  "forward_from_chat_username": null,
  "posted": {
    "$date": "2023-06-08T10:03:00.000Z"
  },
  "market_entities": {
    "dxy": {
      "name": "dxy",
      "description": "usd index",
      "Open": 104.07,
      "Close": 103.34,
      "Low": 103.3,
      "High": 104.07,
      "200MA": 105.4735,
      "AboveMA": 0,
      "AboveMADays": 136,
      "RSI": 50.0706344663702
    },
    "gold": {
      "name": "gold",
      "description": "gold infinite future price",
      "Open": 1977.2,
      "Close": 1998.1,
      "Low": 1976.5,
      "High": 2005,
      "200MA": 1860.948,
      "AboveMA": 1,
      "AboveMADays": 129,
      "RSI": 49.03960910299275
    },
    "btc": {
      "name": "btc",
      "description": "bitcoin price",
      "Open": 26341.8,
      "Close": 26501.1,
      "Low": 26231.3,
      "High": 26784.4,
      "200MA": 23391.599,
      "AboveMA": 1,
      "AboveMADays": 147,
      "RSI": 45.384722840599565
    },
    "RUB": {
      "name": "btc",
      "description": "ruble quote",
      "Open": 81.98,
      "Close": 82.5975,
      "Low": 81.8241,
      "High": 82.7439,
      "200MA": 69.78389299999999,
      "AboveMA": 1,
      "AboveMADays": 119,
      "RSI": 66.41579687841256
    },
    "BR": {
      "name": "btc",
      "description": "brent oil price",
      "Open": 76.66,
      "Close": 75.84,
      "Low": 73.53,
      "High": 77.54,
      "200MA": 83.9825,
      "AboveMA": 0,
      "AboveMADays": 200,
      "RSI": 48.19634651792399
    }
  },
  "views": null,
  "msg_id": 938,
  "forwards": null,
  "outgoing": false,
  "media": "None",
  "reactions": [],
  "edit_date": null,
  "mentioned": false,
  "scheduled": false,
  "from_scheduled": false,
  "hashtags": [],
  "entities": [
    {
      "type": "MessageEntityType.ITALIC",
      "offset": 0,
      "length": 80
    }
  ],
  "mentions": [],
  "tg_urls": [],
  "symbols": 80,
  "words": 12,
  "new_timestamp": 1686193380,
  "outlier": 0
},
{
  "_id": {
    "$oid": "678c331f86ed4bbab4874708"
  },
  "text": "This message couldn't be displayed on your device due to copyright infringement.",
  "timestamp": 1685949734,
  "posted_str_date": "06/05/2023",
  "forward_from_user_username": null,
  "forward_from_chat_username": null,
  "posted": {
    "$date": "2023-06-05T14:22:14.000Z"
  },
  "market_entities": {
    "dxy": {
      "name": "dxy",
      "description": "usd index",
      "Open": 104.04,
      "Close": 104,
      "Low": 103.93,
      "High": 104.4,
      "200MA": 105.55145,
      "AboveMA": 0,
      "AboveMADays": 133,
      "RSI": 60.39345821778682
    },
    "gold": {
      "name": "gold",
      "description": "gold infinite future price",
      "Open": 1982.4,
      "Close": 1993.9,
      "Low": 1973.9,
      "High": 1999.5,
      "200MA": 1857.4175,
      "AboveMA": 1,
      "AboveMADays": 126,
      "RSI": 47.08215451200071
    },
    "btc": {
      "name": "btc",
      "description": "bitcoin price",
      "Open": 27122.3,
      "Close": 25747.4,
      "Low": 25437.5,
      "High": 27125.5,
      "200MA": 23239.351,
      "AboveMA": 1,
      "AboveMADays": 144,
      "RSI": 36.60996559255996
    },
    "RUB": {
      "name": "btc",
      "description": "ruble quote",
      "Open": 81.5,
      "Close": 80.9525,
      "Low": 80.7533,
      "High": 81.91,
      "200MA": 69.4522305,
      "AboveMA": 1,
      "AboveMADays": 116,
      "RSI": 56.798305788647376
    },
    "BR": {
      "name": "btc",
      "description": "brent oil price",
      "Open": 77.88,
      "Close": 76.47,
      "Low": 76.06,
      "High": 78.47,
      "200MA": 84.34065000000001,
      "AboveMA": 0,
      "AboveMADays": 197,
      "RSI": 50.10873251197082
    }
  },
  "views": null,
  "msg_id": 937,
  "forwards": null,
  "outgoing": false,
  "media": "None",
  "reactions": [],
  "edit_date": null,
  "mentioned": false,
  "scheduled": false,
  "from_scheduled": false,
  "hashtags": [],
  "entities": [
    {
      "type": "MessageEntityType.ITALIC",
      "offset": 0,
      "length": 80
    }
  ],
  "mentions": [],
  "tg_urls": [],
  "symbols": 80,
  "words": 12,
  "new_timestamp": 1685949734,
  "outlier": 0
},
{
  "_id": {
    "$oid": "678c331f86ed4bbab4874709"
  },
  "text": "This message couldn't be displayed on your device due to copyright infringement.",
  "timestamp": 1685673864,
  "posted_str_date": "06/02/2023",
  "forward_from_user_username": null,
  "forward_from_chat_username": null,
  "posted": {
    "$date": "2023-06-02T09:44:24.000Z"
  },
  "market_entities": {
    "dxy": {
      "name": "dxy",
      "description": "usd index",
      "Open": 103.56,
      "Close": 104.01,
      "Low": 103.38,
      "High": 104.09,
      "200MA": 105.5756,
      "AboveMA": 0,
      "AboveMADays": 132,
      "RSI": 60.54127162054817
    },
    "gold": {
      "name": "gold",
      "description": "gold infinite future price",
      "Open": 2013.6,
      "Close": 1989.1,
      "Low": 1983.6,
      "High": 2020,
      "200MA": 1856.2555,
      "AboveMA": 1,
      "AboveMADays": 125,
      "RSI": 45.670257710428416
    },
    "btc": {
      "name": "btc",
      "description": "bitcoin price",
      "Open": 26819,
      "Close": 27244.7,
      "Low": 26541.3,
      "High": 27299.4,
      "200MA": 23090.2765,
      "AboveMA": 1,
      "AboveMADays": 141,
      "RSI": 48.96225185643525
    },
    "RUB": {
      "name": "btc",
      "description": "ruble quote",
      "Open": 80.7575,
      "Close": 81.5,
      "Low": 80.6331,
      "High": 81.5115,
      "200MA": 69.342968,
      "AboveMA": 1,
      "AboveMADays": 115,
      "RSI": 61.8328385421636
    },
    "BR": {
      "name": "btc",
      "description": "brent oil price",
      "Open": 74.2,
      "Close": 75.97,
      "Low": 74.11,
      "High": 76.33,
      "200MA": 84.46,
      "AboveMA": 0,
      "AboveMADays": 196,
      "RSI": 48.70162337100236
    }
  },
  "views": null,
  "msg_id": 936,
  "forwards": null,
  "outgoing": false,
  "media": "None",
  "reactions": [],
  "edit_date": null,
  "mentioned": false,
  "scheduled": false,
  "from_scheduled": false,
  "hashtags": [],
  "entities": [
    {
      "type": "MessageEntityType.ITALIC",
      "offset": 0,
      "length": 80
    }
  ],
  "mentions": [],
  "tg_urls": [],
  "symbols": 80,
  "words": 12,
  "new_timestamp": 1685673864,
  "outlier": 0
},
{
  "_id": {
    "$oid": "678c331f86ed4bbab487470a"
  },
  "text": "This message couldn't be displayed on your device due to copyright infringement.",
  "timestamp": 1685416921,
  "posted_str_date": "05/30/2023",
  "forward_from_user_username": null,
  "forward_from_chat_username": null,
  "posted": {
    "$date": "2023-05-30T10:22:01.000Z"
  },
  "market_entities": {
    "dxy": {
      "name": "dxy",
      "description": "usd index",
      "Open": 104.3,
      "Close": 104.17,
      "Low": 103.88,
      "High": 104.53,
      "200MA": 105.64585,
      "AboveMA": 0,
      "AboveMADays": 129,
      "RSI": 67.02693230112166
    },
    "gold": {
      "name": "gold",
      "description": "gold infinite future price",
      "Open": 1980.8,
      "Close": 1996.7,
      "Low": 1970,
      "High": 2000.8,
      "200MA": 1852.5885,
      "AboveMA": 1,
      "AboveMADays": 122,
      "RSI": 47.50603813160049
    },
    "btc": {
      "name": "btc",
      "description": "bitcoin price",
      "Open": 27738.9,
      "Close": 27698.2,
      "Low": 27583.8,
      "High": 28033.6,
      "200MA": 22932.544500000004,
      "AboveMA": 1,
      "AboveMADays": 138,
      "RSI": 52.999863572462765
    },
    "RUB": {
      "name": "btc",
      "description": "ruble quote",
      "Open": 80.83,
      "Close": 81.15,
      "Low": 80.2113,
      "High": 81.3508,
      "200MA": 69.0320805,
      "AboveMA": 1,
      "AboveMADays": 112,
      "RSI": 60.75173196122488
    },
    "BR": {
      "name": "btc",
      "description": "brent oil price",
      "Open": 77.04,
      "Close": 73.71,
      "Low": 73.32,
      "High": 77.59,
      "200MA": 84.80145,
      "AboveMA": 0,
      "AboveMADays": 193,
      "RSI": 40.61257583739905
    }
  },
  "views": null,
  "msg_id": 935,
  "forwards": null,
  "outgoing": false,
  "media": "None",
  "reactions": [],
  "edit_date": null,
  "mentioned": false,
  "scheduled": false,
  "from_scheduled": false,
  "hashtags": [],
  "entities": [
    {
      "type": "MessageEntityType.ITALIC",
      "offset": 0,
      "length": 80
    }
  ],
  "mentions": [],
  "tg_urls": [],
  "symbols": 80,
  "words": 12,
  "new_timestamp": 1685416921,
  "outlier": 0
},
{
  "_id": {
    "$oid": "678c331f86ed4bbab487470b"
  },
  "text": "This message couldn't be displayed on your device due to copyright infringement.",
  "timestamp": 1685174224,
  "posted_str_date": "05/27/2023",
  "forward_from_user_username": null,
  "forward_from_chat_username": null,
  "posted": {
    "$date": "2023-05-27T14:57:04.000Z"
  },
  "market_entities": {
    "dxy": {
      "name": "dxy",
      "description": "usd index",
      "Open": 104.23,
      "Close": 104.21,
      "Low": 103.85,
      "High": 104.42,
      "200MA": 105.69205,
      "AboveMA": 0,
      "AboveMADays": 127,
      "RSI": 68.23319409675364
    },
    "gold": {
      "name": "gold",
      "description": "gold infinite future price",
      "Open": 1961.8,
      "Close": 1963.1,
      "Low": 1954.7,
      "High": 1975.7,
      "200MA": 1850.459,
      "AboveMA": 1,
      "AboveMADays": 120,
      "RSI": 36.53481092559717
    },
    "btc": {
      "name": "btc",
      "description": "bitcoin price",
      "Open": 26711.2,
      "Close": 26857.5,
      "Low": 26591.2,
      "High": 26882.9,
      "200MA": 22767.63,
      "AboveMA": 1,
      "AboveMADays": 135,
      "RSI": 44.85085470104144
    },
    "RUB": {
      "name": "btc",
      "description": "ruble quote",
      "Open": 80.1675,
      "Close": 80.06,
      "Low": 79.8262,
      "High": 80.245,
      "200MA": 68.8313305,
      "AboveMA": 1,
      "AboveMADays": 110,
      "RSI": 53.860127941544185
    },
    "BR": {
      "name": "btc",
      "description": "brent oil price",
      "Open": 76.01,
      "Close": 76.98,
      "Low": 75.66,
      "High": 77.32,
      "200MA": 84.99130000000001,
      "AboveMA": 0,
      "AboveMADays": 191,
      "RSI": 49.30164809919542
    }
  },
  "views": null,
  "msg_id": 934,
  "forwards": null,
  "outgoing": false,
  "media": "None",
  "reactions": [],
  "edit_date": null,
  "mentioned": false,
  "scheduled": false,
  "from_scheduled": false,
  "hashtags": [],
  "entities": [
    {
      "type": "MessageEntityType.ITALIC",
      "offset": 0,
      "length": 80
    }
  ],
  "mentions": [],
  "tg_urls": [],
  "symbols": 80,
  "words": 12,
  "new_timestamp": 1685174224,
  "outlier": 0
},
{
  "_id": {
    "$oid": "678c331f86ed4bbab487470c"
  },
  "text": "This message couldn't be displayed on your device due to copyright infringement.",
  "timestamp": 1684955436,
  "posted_str_date": "05/25/2023",
  "forward_from_user_username": null,
  "forward_from_chat_username": null,
  "posted": {
    "$date": "2023-05-25T02:10:36.000Z"
  },
  "market_entities": {
    "dxy": {
      "name": "dxy",
      "description": "usd index",
      "Open": 103.86,
      "Close": 104.25,
      "Low": 103.84,
      "High": 104.31,
      "200MA": 105.71185,
      "AboveMA": 0,
      "AboveMADays": 126,
      "RSI": 68.86969654098917
    },
    "gold": {
      "name": "gold",
      "description": "gold infinite future price",
      "Open": 1978,
      "Close": 1962.3,
      "Low": 1957.6,
      "High": 1983.9,
      "200MA": 1849.592,
      "AboveMA": 1,
      "AboveMADays": 119,
      "RSI": 36.25290169337061
    },
    "btc": {
      "name": "btc",
      "description": "bitcoin price",
      "Open": 26327.1,
      "Close": 26475.8,
      "Low": 25892.5,
      "High": 26589.2,
      "200MA": 22695.367,
      "AboveMA": 1,
      "AboveMADays": 133,
      "RSI": 40.21052157540927
    },
    "RUB": {
      "name": "btc",
      "description": "ruble quote",
      "Open": 80.1475,
      "Close": 80.1675,
      "Low": 79.744,
      "High": 80.3325,
      "200MA": 68.7343805,
      "AboveMA": 1,
      "AboveMADays": 109,
      "RSI": 54.72062545411515
    },
    "BR": {
      "name": "btc",
      "description": "brent oil price",
      "Open": 78.21,
      "Close": 76.18,
      "Low": 75.05,
      "High": 78.39,
      "200MA": 85.0651,
      "AboveMA": 0,
      "AboveMADays": 190,
      "RSI": 46.871960803040864
    }
  },
  "views": null,
  "msg_id": 933,
  "forwards": null,
  "outgoing": false,
  "media": "None",
  "reactions": [],
  "edit_date": null,
  "mentioned": false,
  "scheduled": false,
  "from_scheduled": false,
  "hashtags": [],
  "entities": [
    {
      "type": "MessageEntityType.ITALIC",
      "offset": 0,
      "length": 80
    }
  ],
  "mentions": [],
  "tg_urls": [],
  "symbols": 80,
  "words": 12,
  "new_timestamp": 1684955436,
  "outlier": 0
},
{
  "_id": {
    "$oid": "678c331f86ed4bbab487470d"
  },
  "text": "This message couldn't be displayed on your device due to copyright infringement.",
  "timestamp": 1684554310,
  "posted_str_date": "05/20/2023",
  "forward_from_user_username": null,
  "forward_from_chat_username": null,
  "posted": {
    "$date": "2023-05-20T10:45:10.000Z"
  },
  "market_entities": {
    "dxy": {
      "name": "dxy",
      "description": "usd index",
      "Open": 103.51,
      "Close": 103.2,
      "Low": 103,
      "High": 103.62,
      "200MA": 105.7732,
      "AboveMA": 0,
      "AboveMADays": 122,
      "RSI": 60.467440633015336
    },
    "gold": {
      "name": "gold",
      "description": "gold infinite future price",
      "Open": 1979.3,
      "Close": 2000.3,
      "Low": 1974.9,
      "High": 2005.8,
      "200MA": 1846.095,
      "AboveMA": 1,
      "AboveMADays": 115,
      "RSI": 44.51278135608794
    },
    "btc": {
      "name": "btc",
      "description": "bitcoin price",
      "Open": 26883,
      "Close": 27116.2,
      "Low": 26831.3,
      "High": 27147.2,
      "200MA": 22545.879499999995,
      "AboveMA": 1,
      "AboveMADays": 128,
      "RSI": 43.6244652465895
    },
    "RUB": {
      "name": "btc",
      "description": "ruble quote",
      "Open": 80.2225,
      "Close": 80,
      "Low": 79.6575,
      "High": 80.5665,
      "200MA": 68.342118,
      "AboveMA": 1,
      "AboveMADays": 105,
      "RSI": 53.85056519184259
    },
    "BR": {
      "name": "btc",
      "description": "brent oil price",
      "Open": 75.98,
      "Close": 75.47,
      "Low": 75.03,
      "High": 77.39,
      "200MA": 85.45855,
      "AboveMA": 0,
      "AboveMADays": 186,
      "RSI": 44.3270292941045
    }
  },
  "views": null,
  "msg_id": 931,
  "forwards": null,
  "outgoing": false,
  "media": "None",
  "reactions": [],
  "edit_date": null,
  "mentioned": false,
  "scheduled": false,
  "from_scheduled": false,
  "hashtags": [],
  "entities": [
    {
      "type": "MessageEntityType.ITALIC",
      "offset": 0,
      "length": 80
    }
  ],
  "mentions": [],
  "tg_urls": [],
  "symbols": 80,
  "words": 12,
  "new_timestamp": 1684554310,
  "outlier": 0
},
{
  "_id": {
    "$oid": "678c331f86ed4bbab487470e"
  },
  "text": "This message couldn't be displayed on your device due to copyright infringement.",
  "timestamp": 1684263940,
  "posted_str_date": "05/17/2023",
  "forward_from_user_username": null,
  "forward_from_chat_username": null,
  "posted": {
    "$date": "2023-05-17T02:05:40.000Z"
  },
  "market_entities": {
    "dxy": {
      "name": "dxy",
      "description": "usd index",
      "Open": 102.61,
      "Close": 102.88,
      "Low": 102.54,
      "High": 103.11,
      "200MA": 105.7929,
      "AboveMA": 0,
      "AboveMADays": 120,
      "RSI": 59.76335918026527
    },
    "gold": {
      "name": "gold",
      "description": "gold infinite future price",
      "Open": 2012.1,
      "Close": 2003.7,
      "Low": 1997.1,
      "High": 2015.9,
      "200MA": 1844.2895,
      "AboveMA": 1,
      "AboveMADays": 113,
      "RSI": 43.489000041251145
    },
    "btc": {
      "name": "btc",
      "description": "bitcoin price",
      "Open": 27035.5,
      "Close": 27403.1,
      "Low": 26597.7,
      "High": 27465.3,
      "200MA": 22449.774500000003,
      "AboveMA": 1,
      "AboveMADays": 125,
      "RSI": 44.986115426094976
    },
    "RUB": {
      "name": "btc",
      "description": "ruble quote",
      "Open": 80.395,
      "Close": 79.8625,
      "Low": 79.7858,
      "High": 81.05,
      "200MA": 68.14565549999999,
      "AboveMA": 1,
      "AboveMADays": 103,
      "RSI": 53.46639530596824
    },
    "BR": {
      "name": "btc",
      "description": "brent oil price",
      "Open": 74.51,
      "Close": 76.81,
      "Low": 73.95,
      "High": 77.13,
      "200MA": 85.65205,
      "AboveMA": 0,
      "AboveMADays": 184,
      "RSI": 47.66155317010978
    }
  },
  "views": null,
  "msg_id": 930,
  "forwards": null,
  "outgoing": false,
  "media": "None",
  "reactions": [],
  "edit_date": null,
  "mentioned": false,
  "scheduled": false,
  "from_scheduled": false,
  "hashtags": [],
  "entities": [
    {
      "type": "MessageEntityType.ITALIC",
      "offset": 0,
      "length": 80
    }
  ],
  "mentions": [],
  "tg_urls": [],
  "symbols": 80,
  "words": 12,
  "new_timestamp": 1684263940,
  "outlier": 0
},
{
  "_id": {
    "$oid": "678c331f86ed4bbab487470f"
  },
  "text": "This message couldn't be displayed on your device due to copyright infringement.",
  "timestamp": 1684048516,
  "posted_str_date": "05/14/2023",
  "forward_from_user_username": null,
  "forward_from_chat_username": null,
  "posted": {
    "$date": "2023-05-14T14:15:16.000Z"
  },
  "market_entities": {
    "dxy": {
      "name": "dxy",
      "description": "usd index",
      "Open": 102.1,
      "Close": 102.68,
      "Low": 101.94,
      "High": 102.71,
      "200MA": 105.84355,
      "AboveMA": 0,
      "AboveMADays": 117,
      "RSI": 58.49423775340588
    },
    "gold": {
      "name": "gold",
      "description": "gold infinite future price",
      "Open": 2039.9,
      "Close": 2039.1,
      "Low": 2025,
      "High": 2046.8,
      "200MA": 1840.872,
      "AboveMA": 1,
      "AboveMADays": 110,
      "RSI": 52.73891547679956
    },
    "btc": {
      "name": "btc",
      "description": "bitcoin price",
      "Open": 26777.4,
      "Close": 26920,
      "Low": 26609.9,
      "High": 27176.1,
      "200MA": 22350.1485,
      "AboveMA": 1,
      "AboveMADays": 122,
      "RSI": 38.96522165960423
    },
    "RUB": {
      "name": "btc",
      "description": "ruble quote",
      "Open": 76.9,
      "Close": 77.92,
      "Low": 76.24,
      "High": 77.9793,
      "200MA": 67.8590305,
      "AboveMA": 1,
      "AboveMADays": 100,
      "RSI": 43.70840718995692
    },
    "BR": {
      "name": "btc",
      "description": "brent oil price",
      "Open": 75.09,
      "Close": 73.9,
      "Low": 73.77,
      "High": 75.6,
      "200MA": 85.92370000000001,
      "AboveMA": 0,
      "AboveMADays": 181,
      "RSI": 38.6157831673404
    }
  },
  "views": null,
  "msg_id": 928,
  "forwards": null,
  "outgoing": false,
  "media": "None",
  "reactions": [],
  "edit_date": null,
  "mentioned": false,
  "scheduled": false,
  "from_scheduled": false,
  "hashtags": [],
  "entities": [
    {
      "type": "MessageEntityType.ITALIC",
      "offset": 0,
      "length": 80
    }
  ],
  "mentions": [],
  "tg_urls": [],
  "symbols": 80,
  "words": 12,
  "new_timestamp": 1684048516,
  "outlier": 0
},
{
  "_id": {
    "$oid": "678c331f86ed4bbab4874710"
  },
  "text": "This message couldn't be displayed on your device due to copyright infringement.",
  "timestamp": 1683789524,
  "posted_str_date": "05/11/2023",
  "forward_from_user_username": null,
  "forward_from_chat_username": null,
  "posted": {
    "$date": "2023-05-11T14:18:44.000Z"
  },
  "market_entities": {
    "dxy": {
      "name": "dxy",
      "description": "usd index",
      "Open": 101.41,
      "Close": 102.06,
      "Low": 101.3,
      "High": 102.15,
      "200MA": 105.86325,
      "AboveMA": 0,
      "AboveMADays": 116,
      "RSI": 52.29816848248436
    },
    "gold": {
      "name": "gold",
      "description": "gold infinite future price",
      "Open": 2056.2,
      "Close": 2039.9,
      "Low": 2036.1,
      "High": 2066.8,
      "200MA": 1839.625,
      "AboveMA": 1,
      "AboveMADays": 109,
      "RSI": 52.95819189662315
    },
    "btc": {
      "name": "btc",
      "description": "bitcoin price",
      "Open": 27604.3,
      "Close": 26983.5,
      "Low": 26766.2,
      "High": 27607.4,
      "200MA": 22248.5835,
      "AboveMA": 1,
      "AboveMADays": 119,
      "RSI": 38.63343692332509
    },
    "RUB": {
      "name": "btc",
      "description": "ruble quote",
      "Open": 76.0575,
      "Close": 76.9,
      "Low": 75.251,
      "High": 77.2017,
      "200MA": 67.77353049999999,
      "AboveMA": 1,
      "AboveMADays": 99,
      "RSI": 36.98294353723266
    },
    "BR": {
      "name": "btc",
      "description": "brent oil price",
      "Open": 76.45,
      "Close": 74.76,
      "Low": 74.44,
      "High": 77.2,
      "200MA": 86.0474,
      "AboveMA": 0,
      "AboveMADays": 180,
      "RSI": 40.32859045350064
    }
  },
  "views": null,
  "msg_id": 927,
  "forwards": null,
  "outgoing": false,
  "media": "None",
  "reactions": [],
  "edit_date": null,
  "mentioned": false,
  "scheduled": false,
  "from_scheduled": false,
  "hashtags": [],
  "entities": [
    {
      "type": "MessageEntityType.ITALIC",
      "offset": 0,
      "length": 80
    }
  ],
  "mentions": [],
  "tg_urls": [],
  "symbols": 80,
  "words": 12,
  "new_timestamp": 1683789524,
  "outlier": 0
},
{
  "_id": {
    "$oid": "678c331f86ed4bbab4874711"
  },
  "text": "This message couldn't be displayed on your device due to copyright infringement.",
  "timestamp": 1683526124,
  "posted_str_date": "05/08/2023",
  "forward_from_user_username": null,
  "forward_from_chat_username": null,
  "posted": {
    "$date": "2023-05-08T13:08:44.000Z"
  },
  "market_entities": {
    "dxy": {
      "name": "dxy",
      "description": "usd index",
      "Open": 101.28,
      "Close": 101.38,
      "Low": 101.04,
      "High": 101.42,
      "200MA": 105.9297,
      "AboveMA": 0,
      "AboveMADays": 113,
      "RSI": 43.67563310133099
    },
    "gold": {
      "name": "gold",
      "description": "gold infinite future price",
      "Open": 2044.2,
      "Close": 2052.8,
      "Low": 2041.5,
      "High": 2056.5,
      "200MA": 1835.5245,
      "AboveMA": 1,
      "AboveMADays": 106,
      "RSI": 57.36772753534821
    },
    "btc": {
      "name": "btc",
      "description": "bitcoin price",
      "Open": 28424.8,
      "Close": 27670.5,
      "Low": 27280.3,
      "High": 28627.8,
      "200MA": 22127.168,
      "AboveMA": 1,
      "AboveMADays": 116,
      "RSI": 43.16492931992318
    },
    "RUB": {
      "name": "btc",
      "description": "ruble quote",
      "Open": 77.38,
      "Close": 78.1875,
      "Low": 76.67,
      "High": 78.486,
      "200MA": 67.610893,
      "AboveMA": 1,
      "AboveMADays": 97,
      "RSI": 40.12949545770446
    },
    "BR": {
      "name": "btc",
      "description": "brent oil price",
      "Open": 75.09,
      "Close": 76.81,
      "Low": 74.72,
      "High": 77.17,
      "200MA": 86.42465,
      "AboveMA": 0,
      "AboveMADays": 177,
      "RSI": 44.46688780322814
    }
  },
  "views": null,
  "msg_id": 926,
  "forwards": null,
  "outgoing": false,
  "media": "None",
  "reactions": [],
  "edit_date": null,
  "mentioned": false,
  "scheduled": false,
  "from_scheduled": false,
  "hashtags": [],
  "entities": [
    {
      "type": "MessageEntityType.ITALIC",
      "offset": 0,
      "length": 80
    }
  ],
  "mentions": [],
  "tg_urls": [],
  "symbols": 80,
  "words": 12,
  "new_timestamp": 1683526124,
  "outlier": 0
},
{
  "_id": {
    "$oid": "678c331f86ed4bbab4874712"
  },
  "text": "This message couldn't be displayed on your device due to copyright infringement.",
  "timestamp": 1683258654,
  "posted_str_date": "05/05/2023",
  "forward_from_user_username": null,
  "forward_from_chat_username": null,
  "posted": {
    "$date": "2023-05-05T10:50:54.000Z"
  },
  "market_entities": {
    "dxy": {
      "name": "dxy",
      "description": "usd index",
      "Open": 101.34,
      "Close": 101.21,
      "Low": 101.12,
      "High": 101.78,
      "200MA": 105.95005,
      "AboveMA": 0,
      "AboveMADays": 112,
      "RSI": 41.445438190966655
    },
    "gold": {
      "name": "gold",
      "description": "gold infinite future price",
      "Open": 2075.4,
      "Close": 2044.2,
      "Low": 2026.2,
      "High": 2080.3,
      "200MA": 1833.9005,
      "AboveMA": 1,
      "AboveMADays": 105,
      "RSI": 55.64065257479895
    },
    "btc": {
      "name": "btc",
      "description": "bitcoin price",
      "Open": 28842.2,
      "Close": 29513.2,
      "Low": 28825.3,
      "High": 29653.9,
      "200MA": 21989.881,
      "AboveMA": 1,
      "AboveMADays": 113,
      "RSI": 56.63194530135716
    },
    "RUB": {
      "name": "btc",
      "description": "ruble quote",
      "Open": 78.05,
      "Close": 77.38,
      "Low": 76.3419,
      "High": 78.2116,
      "200MA": 67.5105055,
      "AboveMA": 1,
      "AboveMADays": 96,
      "RSI": 32.78713980187604
    },
    "BR": {
      "name": "btc",
      "description": "brent oil price",
      "Open": 72.51,
      "Close": 75.09,
      "Low": 72.26,
      "High": 75.51,
      "200MA": 86.54894999999999,
      "AboveMA": 0,
      "AboveMADays": 176,
      "RSI": 39.87870913611441
    }
  },
  "views": null,
  "msg_id": 925,
  "forwards": null,
  "outgoing": false,
  "media": "None",
  "reactions": [],
  "edit_date": null,
  "mentioned": false,
  "scheduled": false,
  "from_scheduled": false,
  "hashtags": [],
  "entities": [
    {
      "type": "MessageEntityType.ITALIC",
      "offset": 0,
      "length": 80
    }
  ],
  "mentions": [],
  "tg_urls": [],
  "symbols": 80,
  "words": 12,
  "new_timestamp": 1683258654,
  "outlier": 0
},
{
  "_id": {
    "$oid": "678c331f86ed4bbab4874713"
  },
  "text": "This message couldn't be displayed on your device due to copyright infringement.",
  "timestamp": 1682999709,
  "posted_str_date": "05/02/2023",
  "forward_from_user_username": null,
  "forward_from_chat_username": null,
  "posted": {
    "$date": "2023-05-02T10:55:09.000Z"
  },
  "market_entities": {
    "dxy": {
      "name": "dxy",
      "description": "usd index",
      "Open": 102.14,
      "Close": 101.96,
      "Low": 101.88,
      "High": 102.4,
      "200MA": 106.0238,
      "AboveMA": 0,
      "AboveMADays": 109,
      "RSI": 48.41034736874991
    },
    "gold": {
      "name": "gold",
      "description": "gold infinite future price",
      "Open": 2009.3,
      "Close": 2042.5,
      "Low": 2006,
      "High": 2047.8,
      "200MA": 1828.964,
      "AboveMA": 1,
      "AboveMADays": 102,
      "RSI": 58.10486611662656
    },
    "btc": {
      "name": "btc",
      "description": "bitcoin price",
      "Open": 28079,
      "Close": 28669.1,
      "Low": 27913.2,
      "High": 28877.4,
      "200MA": 21842.3805,
      "AboveMA": 1,
      "AboveMADays": 110,
      "RSI": 50.92092421452875
    },
    "RUB": {
      "name": "btc",
      "description": "ruble quote",
      "Open": 80.25,
      "Close": 79.62,
      "Low": 79.5907,
      "High": 80.5883,
      "200MA": 67.182118,
      "AboveMA": 1,
      "AboveMADays": 93,
      "RSI": 46.585790796728816
    },
    "BR": {
      "name": "btc",
      "description": "brent oil price",
      "Open": 78.9,
      "Close": 75.04,
      "Low": 74.8,
      "High": 79.4,
      "200MA": 86.94115,
      "AboveMA": 0,
      "AboveMADays": 173,
      "RSI": 35.42153746050606
    }
  },
  "views": null,
  "msg_id": 924,
  "forwards": null,
  "outgoing": false,
  "media": "None",
  "reactions": [],
  "edit_date": null,
  "mentioned": false,
  "scheduled": false,
  "from_scheduled": false,
  "hashtags": [],
  "entities": [
    {
      "type": "MessageEntityType.ITALIC",
      "offset": 0,
      "length": 80
    }
  ],
  "mentions": [],
  "tg_urls": [],
  "symbols": 80,
  "words": 12,
  "new_timestamp": 1682999709,
  "outlier": 0
},
{
  "_id": {
    "$oid": "678c331f86ed4bbab4874714"
  },
  "text": "This message couldn't be displayed on your device due to copyright infringement.",
  "timestamp": 1682740565,
  "posted_str_date": "04/29/2023",
  "forward_from_user_username": null,
  "forward_from_chat_username": null,
  "posted": {
    "$date": "2023-04-29T10:56:05.000Z"
  },
  "market_entities": {
    "dxy": {
      "name": "dxy",
      "description": "usd index",
      "Open": 101.47,
      "Close": 101.66,
      "Low": 101.42,
      "High": 102.17,
      "200MA": 106.0716,
      "AboveMA": 0,
      "AboveMADays": 107,
      "RSI": 44.97487441316522
    },
    "gold": {
      "name": "gold",
      "description": "gold infinite future price",
      "Open": 2016.4,
      "Close": 2018.3,
      "Low": 2003.6,
      "High": 2022.9,
      "200MA": 1825.8385,
      "AboveMA": 1,
      "AboveMADays": 100,
      "RSI": 52.72553914865699
    },
    "btc": {
      "name": "btc",
      "description": "bitcoin price",
      "Open": 29318.4,
      "Close": 29234.1,
      "Low": 29058.5,
      "High": 29425.5,
      "200MA": 21700.968500000003,
      "AboveMA": 1,
      "AboveMADays": 107,
      "RSI": 55.61929405485501
    },
    "RUB": {
      "name": "btc",
      "description": "ruble quote",
      "Open": 81.3325,
      "Close": 80.25,
      "Low": 79.0745,
      "High": 81.6267,
      "200MA": 67.06128050000001,
      "AboveMA": 1,
      "AboveMADays": 92,
      "RSI": 51.82372917711763
    },
    "BR": {
      "name": "btc",
      "description": "brent oil price",
      "Open": 78.27,
      "Close": 80.33,
      "Low": 77.51,
      "High": 80.53,
      "200MA": 87.1805,
      "AboveMA": 0,
      "AboveMADays": 171,
      "RSI": 46.83550812679246
    }
  },
  "views": null,
  "msg_id": 923,
  "forwards": null,
  "outgoing": false,
  "media": "None",
  "reactions": [],
  "edit_date": null,
  "mentioned": false,
  "scheduled": false,
  "from_scheduled": false,
  "hashtags": [],
  "entities": [
    {
      "type": "MessageEntityType.ITALIC",
      "offset": 0,
      "length": 80
    }
  ],
  "mentions": [],
  "tg_urls": [],
  "symbols": 80,
  "words": 12,
  "new_timestamp": 1682740565,
  "outlier": 0
},
{
  "_id": {
    "$oid": "678c331f86ed4bbab4874715"
  },
  "text": "This message couldn't be displayed on your device due to copyright infringement.",
  "timestamp": 1682481134,
  "posted_str_date": "04/26/2023",
  "forward_from_user_username": null,
  "forward_from_chat_username": null,
  "posted": {
    "$date": "2023-04-26T10:52:14.000Z"
  },
  "market_entities": {
    "dxy": {
      "name": "dxy",
      "description": "usd index",
      "Open": 101.82,
      "Close": 101.47,
      "Low": 101.01,
      "High": 101.89,
      "200MA": 106.124,
      "AboveMA": 0,
      "AboveMADays": 105,
      "RSI": 42.74290543846157
    },
    "gold": {
      "name": "gold",
      "description": "gold infinite future price",
      "Open": 2026,
      "Close": 2014.9,
      "Low": 2012.9,
      "High": 2039.1,
      "200MA": 1822.836,
      "AboveMA": 1,
      "AboveMADays": 98,
      "RSI": 51.96283657539821
    },
    "btc": {
      "name": "btc",
      "description": "bitcoin price",
      "Open": 28298.8,
      "Close": 28424.6,
      "Low": 27307.8,
      "High": 29995.7,
      "200MA": 21548.983000000004,
      "AboveMA": 1,
      "AboveMADays": 104,
      "RSI": 50.818420942507295
    },
    "RUB": {
      "name": "btc",
      "description": "ruble quote",
      "Open": 81.6175,
      "Close": 81.6211,
      "Low": 81.4957,
      "High": 81.7392,
      "200MA": 66.820893,
      "AboveMA": 1,
      "AboveMADays": 90,
      "RSI": 66.76646229343439
    },
    "BR": {
      "name": "btc",
      "description": "brent oil price",
      "Open": 80.71,
      "Close": 77.72,
      "Low": 77.5,
      "High": 81.36,
      "200MA": 87.41145,
      "AboveMA": 0,
      "AboveMADays": 169,
      "RSI": 38.33900711703637
    }
  },
  "views": null,
  "msg_id": 922,
  "forwards": null,
  "outgoing": false,
  "media": "None",
  "reactions": [],
  "edit_date": null,
  "mentioned": false,
  "scheduled": false,
  "from_scheduled": false,
  "hashtags": [],
  "entities": [
    {
      "type": "MessageEntityType.ITALIC",
      "offset": 0,
      "length": 80
    }
  ],
  "mentions": [],
  "tg_urls": [],
  "symbols": 80,
  "words": 12,
  "new_timestamp": 1682481134,
  "outlier": 0
},
{
  "_id": {
    "$oid": "678c331f86ed4bbab4874716"
  },
  "text": "This message couldn't be displayed on your device due to copyright infringement.",
  "timestamp": 1682237242,
  "posted_str_date": "04/23/2023",
  "forward_from_user_username": null,
  "forward_from_chat_username": null,
  "posted": {
    "$date": "2023-04-23T15:07:22.000Z"
  },
  "market_entities": {
    "dxy": {
      "name": "dxy",
      "description": "usd index",
      "Open": 101.8,
      "Close": 101.82,
      "Low": 101.65,
      "High": 102.12,
      "200MA": 106.20625,
      "AboveMA": 0,
      "AboveMADays": 102,
      "RSI": 44.41906137752728
    },
    "gold": {
      "name": "gold",
      "description": "gold infinite future price",
      "Open": 2034.4,
      "Close": 2009.2,
      "Low": 2001.4,
      "High": 2035.4,
      "200MA": 1818.4015,
      "AboveMA": 1,
      "AboveMADays": 95,
      "RSI": 51.187703831568896
    },
    "btc": {
      "name": "btc",
      "description": "bitcoin price",
      "Open": 27813.8,
      "Close": 27591.4,
      "Low": 27388.5,
      "High": 27815,
      "200MA": 21422.3345,
      "AboveMA": 1,
      "AboveMADays": 101,
      "RSI": 44.58225687694601
    },
    "RUB": {
      "name": "btc",
      "description": "ruble quote",
      "Open": 81.555,
      "Close": 81.7,
      "Low": 81.2685,
      "High": 81.7851,
      "200MA": 66.4756,
      "AboveMA": 1,
      "AboveMADays": 87,
      "RSI": 69.30833833309795
    },
    "BR": {
      "name": "btc",
      "description": "brent oil price",
      "Open": 80.54,
      "Close": 81.46,
      "Low": 80.21,
      "High": 81.81,
      "200MA": 87.65090000000001,
      "AboveMA": 0,
      "AboveMADays": 166,
      "RSI": 47.67898448282778
    }
  },
  "views": null,
  "msg_id": 921,
  "forwards": null,
  "outgoing": false,
  "media": "None",
  "reactions": [],
  "edit_date": null,
  "mentioned": false,
  "scheduled": false,
  "from_scheduled": false,
  "hashtags": [],
  "entities": [
    {
      "type": "MessageEntityType.ITALIC",
      "offset": 0,
      "length": 80
    }
  ],
  "mentions": [],
  "tg_urls": [],
  "symbols": 80,
  "words": 12,
  "new_timestamp": 1682237242,
  "outlier": 0
},
{
  "_id": {
    "$oid": "678c331f86ed4bbab4874717"
  },
  "text": "This message couldn't be displayed on your device due to copyright infringement.",
  "timestamp": 1681891830,
  "posted_str_date": "04/19/2023",
  "forward_from_user_username": null,
  "forward_from_chat_username": null,
  "posted": {
    "$date": "2023-04-19T15:10:30.000Z"
  },
  "market_entities": {
    "dxy": {
      "name": "dxy",
      "description": "usd index",
      "Open": 101.71,
      "Close": 101.97,
      "Low": 101.66,
      "High": 102.23,
      "200MA": 106.27095,
      "AboveMA": 0,
      "AboveMADays": 100,
      "RSI": 45.67339782473356
    },
    "gold": {
      "name": "gold",
      "description": "gold infinite future price",
      "Open": 2036.2,
      "Close": 2025.9,
      "Low": 1999.5,
      "High": 2038.6,
      "200MA": 1815.5345,
      "AboveMA": 1,
      "AboveMADays": 93,
      "RSI": 55.400079473046965
    },
    "btc": {
      "name": "btc",
      "description": "bitcoin price",
      "Open": 30382.2,
      "Close": 28813.7,
      "Low": 28641.1,
      "High": 30408.4,
      "200MA": 21263.6725,
      "AboveMA": 1,
      "AboveMADays": 97,
      "RSI": 51.52619473821508
    },
    "RUB": {
      "name": "btc",
      "description": "ruble quote",
      "Open": 81.45,
      "Close": 81.8975,
      "Low": 81.45,
      "High": 81.9012,
      "200MA": 66.258425,
      "AboveMA": 1,
      "AboveMADays": 85,
      "RSI": 72.45825551044398
    },
    "BR": {
      "name": "btc",
      "description": "brent oil price",
      "Open": 84.54,
      "Close": 82.79,
      "Low": 82.14,
      "High": 84.83,
      "200MA": 87.83840000000001,
      "AboveMA": 0,
      "AboveMADays": 164,
      "RSI": 51.55732827593112
    }
  },
  "views": null,
  "msg_id": 920,
  "forwards": null,
  "outgoing": false,
  "media": "None",
  "reactions": [],
  "edit_date": null,
  "mentioned": false,
  "scheduled": false,
  "from_scheduled": false,
  "hashtags": [],
  "entities": [
    {
      "type": "MessageEntityType.ITALIC",
      "offset": 0,
      "length": 80
    }
  ],
  "mentions": [],
  "tg_urls": [],
  "symbols": 80,
  "words": 12,
  "new_timestamp": 1681891830,
  "outlier": 0
},
{
  "_id": {
    "$oid": "678c332086ed4bbab4874718"
  },
  "text": "This message couldn't be displayed on your device due to copyright infringement.",
  "timestamp": 1681716577,
  "posted_str_date": "04/17/2023",
  "forward_from_user_username": null,
  "forward_from_chat_username": null,
  "posted": {
    "$date": "2023-04-17T14:29:37.000Z"
  },
  "market_entities": {
    "dxy": {
      "name": "dxy",
      "description": "usd index",
      "Open": 101.58,
      "Close": 102.1,
      "Low": 101.53,
      "High": 102.23,
      "200MA": 106.3325,
      "AboveMA": 0,
      "AboveMADays": 98,
      "RSI": 46.22592492320096
    },
    "gold": {
      "name": "gold",
      "description": "gold infinite future price",
      "Open": 2033,
      "Close": 2025.7,
      "Low": 2012.5,
      "High": 2046.6,
      "200MA": 1812.7085,
      "AboveMA": 1,
      "AboveMADays": 91,
      "RSI": 56.12949742440965
    },
    "btc": {
      "name": "btc",
      "description": "bitcoin price",
      "Open": 30310.8,
      "Close": 29434.9,
      "Low": 29274,
      "High": 30312.2,
      "200MA": 21161.3675,
      "AboveMA": 1,
      "AboveMADays": 95,
      "RSI": 58.8286440779312
    },
    "RUB": {
      "name": "btc",
      "description": "ruble quote",
      "Open": 81.79,
      "Close": 81.4025,
      "Low": 81.1904,
      "High": 82.2,
      "200MA": 66.0681875,
      "AboveMA": 1,
      "AboveMADays": 83,
      "RSI": 70.19622652769752
    },
    "BR": {
      "name": "btc",
      "description": "brent oil price",
      "Open": 85.9,
      "Close": 84.45,
      "Low": 84.05,
      "High": 86.07,
      "200MA": 88.0244,
      "AboveMA": 0,
      "AboveMADays": 162,
      "RSI": 57.50734071537416
    }
  },
  "views": null,
  "msg_id": 918,
  "forwards": null,
  "outgoing": false,
  "media": "None",
  "reactions": [],
  "edit_date": null,
  "mentioned": false,
  "scheduled": false,
  "from_scheduled": false,
  "hashtags": [],
  "entities": [
    {
      "type": "MessageEntityType.ITALIC",
      "offset": 0,
      "length": 80
    }
  ],
  "mentions": [],
  "tg_urls": [],
  "symbols": 80,
  "words": 12,
  "new_timestamp": 1681716577,
  "outlier": 0
},
{
  "_id": {
    "$oid": "678c332086ed4bbab4874719"
  },
  "text": "This message couldn't be displayed on your device due to copyright infringement.",
  "timestamp": 1681456440,
  "posted_str_date": "04/14/2023",
  "forward_from_user_username": null,
  "forward_from_chat_username": null,
  "posted": {
    "$date": "2023-04-14T14:14:00.000Z"
  },
  "market_entities": {
    "dxy": {
      "name": "dxy",
      "description": "usd index",
      "Open": 101,
      "Close": 101.55,
      "Low": 100.79,
      "High": 101.75,
      "200MA": 106.3621,
      "AboveMA": 0,
      "AboveMADays": 97,
      "RSI": 40.86834879524877
    },
    "gold": {
      "name": "gold",
      "description": "gold infinite future price",
      "Open": 2073.1,
      "Close": 2034.4,
      "Low": 2024.8,
      "High": 2080,
      "200MA": 1811.3055,
      "AboveMA": 1,
      "AboveMADays": 90,
      "RSI": 58.01988747507501
    },
    "btc": {
      "name": "btc",
      "description": "bitcoin price",
      "Open": 30387.4,
      "Close": 30472.5,
      "Low": 30026,
      "High": 30964.9,
      "200MA": 21001.5685,
      "AboveMA": 1,
      "AboveMADays": 92,
      "RSI": 70.73110763634708
    },
    "RUB": {
      "name": "btc",
      "description": "ruble quote",
      "Open": 81.4,
      "Close": 81.79,
      "Low": 81.2068,
      "High": 81.905,
      "200MA": 65.966925,
      "AboveMA": 1,
      "AboveMADays": 82,
      "RSI": 74.34624383219249
    },
    "BR": {
      "name": "btc",
      "description": "brent oil price",
      "Open": 85.75,
      "Close": 85.87,
      "Low": 85.15,
      "High": 86.44,
      "200MA": 88.08760000000001,
      "AboveMA": 0,
      "AboveMADays": 161,
      "RSI": 62.85788716168559
    }
  },
  "views": null,
  "msg_id": 917,
  "forwards": null,
  "outgoing": false,
  "media": "None",
  "reactions": [],
  "edit_date": null,
  "mentioned": false,
  "scheduled": false,
  "from_scheduled": false,
  "hashtags": [],
  "entities": [
    {
      "type": "MessageEntityType.ITALIC",
      "offset": 0,
      "length": 80
    }
  ],
  "mentions": [],
  "tg_urls": [],
  "symbols": 80,
  "words": 12,
  "new_timestamp": 1681456440,
  "outlier": 0
},
{
  "_id": {
    "$oid": "678c332086ed4bbab487471a"
  },
  "text": "This message couldn't be displayed on your device due to copyright infringement.",
  "timestamp": 1681200481,
  "posted_str_date": "04/11/2023",
  "forward_from_user_username": null,
  "forward_from_chat_username": null,
  "posted": {
    "$date": "2023-04-11T15:08:01.000Z"
  },
  "market_entities": {
    "dxy": {
      "name": "dxy",
      "description": "usd index",
      "Open": 102.52,
      "Close": 102.2,
      "Low": 102.01,
      "High": 102.51,
      "200MA": 106.448,
      "AboveMA": 0,
      "AboveMADays": 94,
      "RSI": 43.47531001044737
    },
    "gold": {
      "name": "gold",
      "description": "gold infinite future price",
      "Open": 2025,
      "Close": 2037.3,
      "Low": 2022.2,
      "High": 2040.4,
      "200MA": 1807.2835,
      "AboveMA": 1,
      "AboveMADays": 87,
      "RSI": 62.30570853900436
    },
    "btc": {
      "name": "btc",
      "description": "bitcoin price",
      "Open": 29641,
      "Close": 30209.6,
      "Low": 29597.8,
      "High": 30484.6,
      "200MA": 20832.6075,
      "AboveMA": 1,
      "AboveMADays": 89,
      "RSI": 71.3921217074875
    },
    "RUB": {
      "name": "btc",
      "description": "ruble quote",
      "Open": 81.6125,
      "Close": 81.965,
      "Low": 81.6125,
      "High": 82.5355,
      "200MA": 65.547175,
      "AboveMA": 1,
      "AboveMADays": 79,
      "RSI": 79.05354917932655
    },
    "BR": {
      "name": "btc",
      "description": "brent oil price",
      "Open": 83.87,
      "Close": 85.17,
      "Low": 83.37,
      "High": 85.23,
      "200MA": 88.37735,
      "AboveMA": 0,
      "AboveMADays": 158,
      "RSI": 63.20319318808705
    }
  },
  "views": null,
  "msg_id": 916,
  "forwards": null,
  "outgoing": false,
  "media": "None",
  "reactions": [],
  "edit_date": null,
  "mentioned": false,
  "scheduled": false,
  "from_scheduled": false,
  "hashtags": [],
  "entities": [
    {
      "type": "MessageEntityType.ITALIC",
      "offset": 0,
      "length": 80
    }
  ],
  "mentions": [],
  "tg_urls": [],
  "symbols": 80,
  "words": 12,
  "new_timestamp": 1681200481,
  "outlier": 0
},
{
  "_id": {
    "$oid": "678c332086ed4bbab487471b"
  },
  "text": "This message couldn't be displayed on your device due to copyright infringement.",
  "timestamp": 1680845062,
  "posted_str_date": "04/07/2023",
  "forward_from_user_username": null,
  "forward_from_chat_username": null,
  "posted": {
    "$date": "2023-04-07T12:24:22.000Z"
  },
  "market_entities": {
    "dxy": {
      "name": "dxy",
      "description": "usd index",
      "Open": 101.94,
      "Close": 102.09,
      "Low": 101.88,
      "High": 102.3,
      "200MA": 106.4825,
      "AboveMA": 0,
      "AboveMADays": 92,
      "RSI": 41.4729276811072
    },
    "gold": {
      "name": "gold",
      "description": "gold infinite future price",
      "Open": 2055,
      "Close": 2044.4,
      "Low": 2034.6,
      "High": 2055.4,
      "200MA": 1805.202,
      "AboveMA": 1,
      "AboveMADays": 85,
      "RSI": 65.59441819992138
    },
    "btc": {
      "name": "btc",
      "description": "bitcoin price",
      "Open": 28037.6,
      "Close": 27910.4,
      "Low": 27779.4,
      "High": 28102.5,
      "200MA": 20632.31,
      "AboveMA": 1,
      "AboveMADays": 85,
      "RSI": 58.227911905579845
    },
    "RUB": {
      "name": "btc",
      "description": "ruble quote",
      "Open": 81.375,
      "Close": 81.1275,
      "Low": 80.7848,
      "High": 83.4458,
      "200MA": 65.254475,
      "AboveMA": 1,
      "AboveMADays": 77,
      "RSI": 76.60639738522596
    },
    "BR": {
      "name": "btc",
      "description": "brent oil price",
      "Open": 84.52,
      "Close": 84.67,
      "Low": 83.71,
      "High": 85.03,
      "200MA": 88.63995000000001,
      "AboveMA": 0,
      "AboveMADays": 156,
      "RSI": 63.26037921934074
    }
  },
  "views": null,
  "msg_id": 914,
  "forwards": null,
  "outgoing": false,
  "media": "None",
  "reactions": [],
  "edit_date": null,
  "mentioned": false,
  "scheduled": false,
  "from_scheduled": false,
  "hashtags": [],
  "entities": [
    {
      "type": "MessageEntityType.ITALIC",
      "offset": 0,
      "length": 80
    }
  ],
  "mentions": [],
  "tg_urls": [],
  "symbols": 80,
  "words": 12,
  "new_timestamp": 1680845062,
  "outlier": 0
},
{
  "_id": {
    "$oid": "678c332086ed4bbab487471c"
  },
  "text": "This message couldn't be displayed on your device due to copyright infringement.",
  "timestamp": 1680588113,
  "posted_str_date": "04/04/2023",
  "forward_from_user_username": null,
  "forward_from_chat_username": null,
  "posted": {
    "$date": "2023-04-04T13:01:53.000Z"
  },
  "market_entities": {
    "dxy": {
      "name": "dxy",
      "description": "usd index",
      "Open": 102.01,
      "Close": 101.59,
      "Low": 101.46,
      "High": 102.28,
      "200MA": 106.52835,
      "AboveMA": 0,
      "AboveMADays": 89,
      "RSI": 35.69450741248737
    },
    "gold": {
      "name": "gold",
      "description": "gold infinite future price",
      "Open": 2019.8,
      "Close": 2056.2,
      "Low": 2012.7,
      "High": 2061,
      "200MA": 1803.033,
      "AboveMA": 1,
      "AboveMADays": 83,
      "RSI": 68.72378389557264
    },
    "btc": {
      "name": "btc",
      "description": "bitcoin price",
      "Open": 27802.2,
      "Close": 28164.4,
      "Low": 27668.9,
      "High": 28429.1,
      "200MA": 20507.063,
      "AboveMA": 1,
      "AboveMADays": 82,
      "RSI": 60.627016850092254
    },
    "RUB": {
      "name": "btc",
      "description": "ruble quote",
      "Open": 78.74,
      "Close": 79.52,
      "Low": 78.736,
      "High": 79.567,
      "200MA": 64.8440375,
      "AboveMA": 1,
      "AboveMADays": 74,
      "RSI": 73.14400219058554
    },
    "BR": {
      "name": "btc",
      "description": "brent oil price",
      "Open": 84.52,
      "Close": 84.55,
      "Low": 83.46,
      "High": 85.6,
      "200MA": 88.9174,
      "AboveMA": 0,
      "AboveMADays": 154,
      "RSI": 63.01835214016787
    }
  },
  "views": null,
  "msg_id": 913,
  "forwards": null,
  "outgoing": false,
  "media": "None",
  "reactions": [],
  "edit_date": null,
  "mentioned": false,
  "scheduled": false,
  "from_scheduled": false,
  "hashtags": [],
  "entities": [
    {
      "type": "MessageEntityType.ITALIC",
      "offset": 0,
      "length": 80
    }
  ],
  "mentions": [],
  "tg_urls": [],
  "symbols": 80,
  "words": 12,
  "new_timestamp": 1680588113,
  "outlier": 0
},
{
  "_id": {
    "$oid": "678c332086ed4bbab487471d"
  },
  "text": "This message couldn't be displayed on your device due to copyright infringement.",
  "timestamp": 1680336612,
  "posted_str_date": "04/01/2023",
  "forward_from_user_username": null,
  "forward_from_chat_username": null,
  "posted": {
    "$date": "2023-04-01T15:10:12.000Z"
  },
  "market_entities": {
    "dxy": {
      "name": "dxy",
      "description": "usd index",
      "Open": 102.2,
      "Close": 102.51,
      "Low": 102.05,
      "High": 102.63,
      "200MA": 106.5522,
      "AboveMA": 0,
      "AboveMADays": 87,
      "RSI": 41.90908625550579
    },
    "gold": {
      "name": "gold",
      "description": "gold infinite future price",
      "Open": 2015.8,
      "Close": 2004.1,
      "Low": 2002.3,
      "High": 2022.8,
      "200MA": 1801.049,
      "AboveMA": 1,
      "AboveMADays": 81,
      "RSI": 61.81700491812529
    },
    "btc": {
      "name": "btc",
      "description": "bitcoin price",
      "Open": 28473.7,
      "Close": 28456.1,
      "Low": 28285.6,
      "High": 28795.1,
      "200MA": 20384.872,
      "AboveMA": 1,
      "AboveMADays": 79,
      "RSI": 63.90888402904419
    },
    "RUB": {
      "name": "btc",
      "description": "ruble quote",
      "Open": 77.08,
      "Close": 77.5975,
      "Low": 76.9227,
      "High": 77.9058,
      "200MA": 64.58736250000001,
      "AboveMA": 1,
      "AboveMADays": 72,
      "RSI": 64.4384650397204
    },
    "BR": {
      "name": "btc",
      "description": "brent oil price",
      "Open": 78.47,
      "Close": 79.89,
      "Low": 77.84,
      "High": 79.95,
      "200MA": 89.1497,
      "AboveMA": 0,
      "AboveMADays": 152,
      "RSI": 52.96577810302792
    }
  },
  "views": null,
  "msg_id": 912,
  "forwards": null,
  "outgoing": false,
  "media": "None",
  "reactions": [],
  "edit_date": null,
  "mentioned": false,
  "scheduled": false,
  "from_scheduled": false,
  "hashtags": [],
  "entities": [
    {
      "type": "MessageEntityType.ITALIC",
      "offset": 0,
      "length": 80
    }
  ],
  "mentions": [],
  "tg_urls": [],
  "symbols": 80,
  "words": 12,
  "new_timestamp": 1680336612,
  "outlier": 0
},
{
  "_id": {
    "$oid": "678c332086ed4bbab487471e"
  },
  "text": "This message couldn't be displayed on your device due to copyright infringement.",
  "timestamp": 1679980667,
  "posted_str_date": "03/28/2023",
  "forward_from_user_username": null,
  "forward_from_chat_username": null,
  "posted": {
    "$date": "2023-03-28T12:17:47.000Z"
  },
  "market_entities": {
    "dxy": {
      "name": "dxy",
      "description": "usd index",
      "Open": 102.75,
      "Close": 102.43,
      "Low": 102.38,
      "High": 102.76,
      "200MA": 106.5798,
      "AboveMA": 0,
      "AboveMADays": 84,
      "RSI": 39.35383694905404
    },
    "gold": {
      "name": "gold",
      "description": "gold infinite future price",
      "Open": 1975.4,
      "Close": 1990.4,
      "Low": 1967.6,
      "High": 1994.2,
      "200MA": 1798.698,
      "AboveMA": 1,
      "AboveMADays": 78,
      "RSI": 61.46999616004154
    },
    "btc": {
      "name": "btc",
      "description": "bitcoin price",
      "Open": 27127.8,
      "Close": 27262.2,
      "Low": 26665.6,
      "High": 27465,
      "200MA": 20248.604000000003,
      "AboveMA": 1,
      "AboveMADays": 75,
      "RSI": 59.74520126510187
    },
    "RUB": {
      "name": "btc",
      "description": "ruble quote",
      "Open": 76.68,
      "Close": 76.9,
      "Low": 76.3272,
      "High": 77.02,
      "200MA": 64.2709,
      "AboveMA": 1,
      "AboveMADays": 69,
      "RSI": 60.67774044573642
    },
    "BR": {
      "name": "btc",
      "description": "brent oil price",
      "Open": 77.83,
      "Close": 78.14,
      "Low": 77.09,
      "High": 78.7,
      "200MA": 89.62819999999999,
      "AboveMA": 0,
      "AboveMADays": 149,
      "RSI": 47.91072714494657
    }
  },
  "views": null,
  "msg_id": 911,
  "forwards": null,
  "outgoing": false,
  "media": "None",
  "reactions": [],
  "edit_date": null,
  "mentioned": false,
  "scheduled": false,
  "from_scheduled": false,
  "hashtags": [],
  "entities": [
    {
      "type": "MessageEntityType.ITALIC",
      "offset": 0,
      "length": 80
    }
  ],
  "mentions": [],
  "tg_urls": [],
  "symbols": 80,
  "words": 12,
  "new_timestamp": 1679980667,
  "outlier": 0
},
{
  "_id": {
    "$oid": "678c332086ed4bbab487471f"
  },
  "text": "This message couldn't be displayed on your device due to copyright infringement.",
  "timestamp": 1679807169,
  "posted_str_date": "03/26/2023",
  "forward_from_user_username": null,
  "forward_from_chat_username": null,
  "posted": {
    "$date": "2023-03-26T12:06:09.000Z"
  },
  "market_entities": {
    "dxy": {
      "name": "dxy",
      "description": "usd index",
      "Open": 102.6,
      "Close": 103.12,
      "Low": 102.5,
      "High": 103.36,
      "200MA": 106.599,
      "AboveMA": 0,
      "AboveMADays": 82,
      "RSI": 44.18880384826373
    },
    "gold": {
      "name": "gold",
      "description": "gold infinite future price",
      "Open": 2013.3,
      "Close": 2001.7,
      "Low": 1995.7,
      "High": 2023.9,
      "200MA": 1797.431,
      "AboveMA": 1,
      "AboveMADays": 76,
      "RSI": 65.77486406817972
    },
    "btc": {
      "name": "btc",
      "description": "bitcoin price",
      "Open": 27474.9,
      "Close": 27973.5,
      "Low": 27429.1,
      "High": 28153.7,
      "200MA": 20180.057,
      "AboveMA": 1,
      "AboveMADays": 73,
      "RSI": 64.94569895919071
    },
    "RUB": {
      "name": "btc",
      "description": "ruble quote",
      "Open": 76,
      "Close": 77.075,
      "Low": 76,
      "High": 77.1211,
      "200MA": 64.0708,
      "AboveMA": 1,
      "AboveMADays": 67,
      "RSI": 62.72930528288717
    },
    "BR": {
      "name": "btc",
      "description": "brent oil price",
      "Open": 75.1,
      "Close": 74.59,
      "Low": 72.35,
      "High": 75.89,
      "200MA": 89.98564999999999,
      "AboveMA": 0,
      "AboveMADays": 147,
      "RSI": 37.32881310444132
    }
  },
  "views": null,
  "msg_id": 910,
  "forwards": null,
  "outgoing": false,
  "media": "None",
  "reactions": [],
  "edit_date": null,
  "mentioned": false,
  "scheduled": false,
  "from_scheduled": false,
  "hashtags": [],
  "entities": [
    {
      "type": "MessageEntityType.ITALIC",
      "offset": 0,
      "length": 80
    }
  ],
  "mentions": [],
  "tg_urls": [],
  "symbols": 80,
  "words": 12,
  "new_timestamp": 1679807169,
  "outlier": 0
},
{
  "_id": {
    "$oid": "678c332086ed4bbab4874720"
  },
  "text": "This message couldn't be displayed on your device due to copyright infringement.",
  "timestamp": 1679551518,
  "posted_str_date": "03/23/2023",
  "forward_from_user_username": null,
  "forward_from_chat_username": null,
  "posted": {
    "$date": "2023-03-23T13:05:18.000Z"
  },
  "market_entities": {
    "dxy": {
      "name": "dxy",
      "description": "usd index",
      "Open": 102.5,
      "Close": 102.53,
      "Low": 101.92,
      "High": 102.64,
      "200MA": 106.6069,
      "AboveMA": 0,
      "AboveMADays": 81,
      "RSI": 38.46025031883352
    },
    "gold": {
      "name": "gold",
      "description": "gold infinite future price",
      "Open": 1992.5,
      "Close": 2013.3,
      "Low": 1984.4,
      "High": 2023.3,
      "200MA": 1796.5655,
      "AboveMA": 1,
      "AboveMADays": 75,
      "RSI": 68.74813446584562
    },
    "btc": {
      "name": "btc",
      "description": "bitcoin price",
      "Open": 27262.8,
      "Close": 28310.7,
      "Low": 27144.6,
      "High": 28734.1,
      "200MA": 20054.8055,
      "AboveMA": 1,
      "AboveMADays": 70,
      "RSI": 68.6452896852766
    },
    "RUB": {
      "name": "btc",
      "description": "ruble quote",
      "Open": 77.0575,
      "Close": 76,
      "Low": 75.7403,
      "High": 77.0575,
      "200MA": 63.969425,
      "AboveMA": 1,
      "AboveMADays": 66,
      "RSI": 56.673291065532894
    },
    "BR": {
      "name": "btc",
      "description": "brent oil price",
      "Open": 75.58,
      "Close": 75.5,
      "Low": 74.67,
      "High": 77.06,
      "200MA": 90.19005,
      "AboveMA": 0,
      "AboveMADays": 146,
      "RSI": 39.20930782629142
    }
  },
  "views": null,
  "msg_id": 909,
  "forwards": null,
  "outgoing": false,
  "media": "None",
  "reactions": [],
  "edit_date": null,
  "mentioned": false,
  "scheduled": false,
  "from_scheduled": false,
  "hashtags": [],
  "entities": [
    {
      "type": "MessageEntityType.ITALIC",
      "offset": 0,
      "length": 80
    }
  ],
  "mentions": [],
  "tg_urls": [],
  "symbols": 80,
  "words": 12,
  "new_timestamp": 1679551518,
  "outlier": 0
},
{
  "_id": {
    "$oid": "678c332086ed4bbab4874721"
  },
  "text": "This message couldn't be displayed on your device due to copyright infringement.",
  "timestamp": 1679462244,
  "posted_str_date": "03/22/2023",
  "forward_from_user_username": null,
  "forward_from_chat_username": null,
  "posted": {
    "$date": "2023-03-22T12:17:24.000Z"
  },
  "market_entities": {
    "dxy": {
      "name": "dxy",
      "description": "usd index",
      "Open": 103.19,
      "Close": 102.35,
      "Low": 102.07,
      "High": 103.26,
      "200MA": 106.6124,
      "AboveMA": 0,
      "AboveMADays": 80,
      "RSI": 36.61722760851109
    },
    "gold": {
      "name": "gold",
      "description": "gold infinite future price",
      "Open": 1959.7,
      "Close": 1966.6,
      "Low": 1953.7,
      "High": 1999.4,
      "200MA": 1795.611,
      "AboveMA": 1,
      "AboveMADays": 74,
      "RSI": 62.39313027377523
    },
    "btc": {
      "name": "btc",
      "description": "bitcoin price",
      "Open": 28114.2,
      "Close": 27261.7,
      "Low": 26668.7,
      "High": 28760.3,
      "200MA": 20013.2515,
      "AboveMA": 1,
      "AboveMADays": 69,
      "RSI": 64.97134542095756
    },
    "RUB": {
      "name": "btc",
      "description": "ruble quote",
      "Open": 76.66,
      "Close": 77.0575,
      "Low": 76.66,
      "High": 77.0915,
      "200MA": 63.886175,
      "AboveMA": 1,
      "AboveMADays": 65,
      "RSI": 66.55113320677236
    },
    "BR": {
      "name": "btc",
      "description": "brent oil price",
      "Open": 74.9,
      "Close": 76.38,
      "Low": 74.26,
      "High": 76.79,
      "200MA": 90.40144999999998,
      "AboveMA": 0,
      "AboveMADays": 145,
      "RSI": 41.06701684792842
    }
  },
  "views": null,
  "msg_id": 907,
  "forwards": null,
  "outgoing": false,
  "media": "None",
  "reactions": [],
  "edit_date": null,
  "mentioned": false,
  "scheduled": false,
  "from_scheduled": false,
  "hashtags": [],
  "entities": [
    {
      "type": "MessageEntityType.ITALIC",
      "offset": 0,
      "length": 80
    }
  ],
  "mentions": [],
  "tg_urls": [],
  "symbols": 80,
  "words": 12,
  "new_timestamp": 1679462244,
  "outlier": 0
},
{
  "_id": {
    "$oid": "678c332086ed4bbab4874722"
  },
  "text": "This message couldn't be displayed on your device due to copyright infringement.",
  "timestamp": 1679202918,
  "posted_str_date": "03/19/2023",
  "forward_from_user_username": null,
  "forward_from_chat_username": null,
  "posted": {
    "$date": "2023-03-19T12:15:18.000Z"
  },
  "market_entities": {
    "dxy": {
      "name": "dxy",
      "description": "usd index",
      "Open": 104.41,
      "Close": 103.71,
      "Low": 103.69,
      "High": 104.44,
      "200MA": 106.64675,
      "AboveMA": 0,
      "AboveMADays": 77,
      "RSI": 45.81405995765712
    },
    "gold": {
      "name": "gold",
      "description": "gold infinite future price",
      "Open": 1942.7,
      "Close": 1990.2,
      "Low": 1939.1,
      "High": 2010.4,
      "200MA": 1793.9145,
      "AboveMA": 1,
      "AboveMADays": 71,
      "RSI": 71.63690020567661
    },
    "btc": {
      "name": "btc",
      "description": "bitcoin price",
      "Open": 26914.5,
      "Close": 27958.7,
      "Low": 26844.6,
      "High": 28347.3,
      "200MA": 19897.3215,
      "AboveMA": 1,
      "AboveMADays": 66,
      "RSI": 71.77584714013871
    },
    "RUB": {
      "name": "btc",
      "description": "ruble quote",
      "Open": 76.4,
      "Close": 77.06,
      "Low": 76.2675,
      "High": 77.1398,
      "200MA": 63.6390375,
      "AboveMA": 1,
      "AboveMADays": 62,
      "RSI": 69.25371127506288
    },
    "BR": {
      "name": "btc",
      "description": "brent oil price",
      "Open": 74.3,
      "Close": 72.77,
      "Low": 71.38,
      "High": 75.59,
      "200MA": 91.06865000000002,
      "AboveMA": 0,
      "AboveMADays": 142,
      "RSI": 29.008731366444948
    }
  },
  "views": null,
  "msg_id": 906,
  "forwards": null,
  "outgoing": false,
  "media": "None",
  "reactions": [],
  "edit_date": null,
  "mentioned": false,
  "scheduled": false,
  "from_scheduled": false,
  "hashtags": [],
  "entities": [
    {
      "type": "MessageEntityType.ITALIC",
      "offset": 0,
      "length": 80
    }
  ],
  "mentions": [],
  "tg_urls": [],
  "symbols": 80,
  "words": 12,
  "new_timestamp": 1679202918,
  "outlier": 0
},
{
  "_id": {
    "$oid": "678c332086ed4bbab4874723"
  },
  "text": "This message couldn't be displayed on your device due to copyright infringement.",
  "timestamp": 1678942595,
  "posted_str_date": "03/16/2023",
  "forward_from_user_username": null,
  "forward_from_chat_username": null,
  "posted": {
    "$date": "2023-03-16T11:56:35.000Z"
  },
  "market_entities": {
    "dxy": {
      "name": "dxy",
      "description": "usd index",
      "Open": 104.62,
      "Close": 104.42,
      "Low": 104.2,
      "High": 104.74,
      "200MA": 106.64895,
      "AboveMA": 0,
      "AboveMADays": 76,
      "RSI": 51.46977707315037
    },
    "gold": {
      "name": "gold",
      "description": "gold infinite future price",
      "Open": 1940.2,
      "Close": 1939.7,
      "Low": 1928.4,
      "High": 1954.6,
      "200MA": 1793.2885,
      "AboveMA": 1,
      "AboveMADays": 70,
      "RSI": 64.08982510384507
    },
    "btc": {
      "name": "btc",
      "description": "bitcoin price",
      "Open": 24283.2,
      "Close": 25004.1,
      "Low": 24147.9,
      "High": 25139,
      "200MA": 19786.658,
      "AboveMA": 1,
      "AboveMADays": 63,
      "RSI": 63.47467700131993
    },
    "RUB": {
      "name": "btc",
      "description": "ruble quote",
      "Open": 75.985,
      "Close": 76.4,
      "Low": 75.955,
      "High": 77.2898,
      "200MA": 63.5584875,
      "AboveMA": 1,
      "AboveMADays": 61,
      "RSI": 66.02982757810229
    },
    "BR": {
      "name": "btc",
      "description": "brent oil price",
      "Open": 73.85,
      "Close": 74.29,
      "Low": 71.49,
      "High": 75.12,
      "200MA": 91.30925,
      "AboveMA": 0,
      "AboveMADays": 141,
      "RSI": 31.30299374230067
    }
  },
  "views": null,
  "msg_id": 905,
  "forwards": null,
  "outgoing": false,
  "media": "None",
  "reactions": [],
  "edit_date": null,
  "mentioned": false,
  "scheduled": false,
  "from_scheduled": false,
  "hashtags": [],
  "entities": [
    {
      "type": "MessageEntityType.ITALIC",
      "offset": 0,
      "length": 80
    }
  ],
  "mentions": [],
  "tg_urls": [],
  "symbols": 80,
  "words": 12,
  "new_timestamp": 1678942595,
  "outlier": 0
},
{
  "_id": {
    "$oid": "678c332086ed4bbab4874724"
  },
  "text": "This message couldn't be displayed on your device due to copyright infringement.",
  "timestamp": 1678686979,
  "posted_str_date": "03/13/2023",
  "forward_from_user_username": null,
  "forward_from_chat_username": null,
  "posted": {
    "$date": "2023-03-13T12:56:19.000Z"
  },
  "market_entities": {
    "dxy": {
      "name": "dxy",
      "description": "usd index",
      "Open": 104.64,
      "Close": 103.6,
      "Low": 103.48,
      "High": 104.64,
      "200MA": 106.626,
      "AboveMA": 0,
      "AboveMADays": 73,
      "RSI": 44.358001205291984
    },
    "gold": {
      "name": "gold",
      "description": "gold infinite future price",
      "Open": 1893.8,
      "Close": 1933,
      "Low": 1892.5,
      "High": 1935.6,
      "200MA": 1792.066,
      "AboveMA": 1,
      "AboveMADays": 67,
      "RSI": 65.00628235531985
    },
    "btc": {
      "name": "btc",
      "description": "bitcoin price",
      "Open": 21994.8,
      "Close": 24114.4,
      "Low": 21859.6,
      "High": 24406.2,
      "200MA": 19715.8955,
      "AboveMA": 1,
      "AboveMADays": 60,
      "RSI": 60.49352289234036
    },
    "RUB": {
      "name": "btc",
      "description": "ruble quote",
      "Open": 76.1,
      "Close": 75,
      "Low": 74.8906,
      "High": 76.1,
      "200MA": 63.34211249999999,
      "AboveMA": 1,
      "AboveMADays": 58,
      "RSI": 57.9045122530212
    },
    "BR": {
      "name": "btc",
      "description": "brent oil price",
      "Open": 82,
      "Close": 80.23,
      "Low": 77.78,
      "High": 82.89,
      "200MA": 91.9471,
      "AboveMA": 0,
      "AboveMADays": 138,
      "RSI": 40.66692769820832
    }
  },
  "views": null,
  "msg_id": 904,
  "forwards": null,
  "outgoing": false,
  "media": "None",
  "reactions": [],
  "edit_date": null,
  "mentioned": false,
  "scheduled": false,
  "from_scheduled": false,
  "hashtags": [],
  "entities": [
    {
      "type": "MessageEntityType.ITALIC",
      "offset": 0,
      "length": 80
    }
  ],
  "mentions": [],
  "tg_urls": [],
  "symbols": 80,
  "words": 12,
  "new_timestamp": 1678686979,
  "outlier": 0
},
{
  "_id": {
    "$oid": "678c332086ed4bbab4874725"
  },
  "text": "This message couldn't be displayed on your device due to copyright infringement.",
  "timestamp": 1678429242,
  "posted_str_date": "03/10/2023",
  "forward_from_user_username": null,
  "forward_from_chat_username": null,
  "posted": {
    "$date": "2023-03-10T13:20:42.000Z"
  },
  "market_entities": {
    "dxy": {
      "name": "dxy",
      "description": "usd index",
      "Open": 105.13,
      "Close": 104.58,
      "Low": 104.04,
      "High": 105.35,
      "200MA": 106.6202,
      "AboveMA": 0,
      "AboveMADays": 72,
      "RSI": 52.63684215287911
    },
    "gold": {
      "name": "gold",
      "description": "gold infinite future price",
      "Open": 1852.1,
      "Close": 1884,
      "Low": 1847,
      "High": 1891.1,
      "200MA": 1791.7980000000002,
      "AboveMA": 1,
      "AboveMADays": 66,
      "RSI": 54.66084961067092
    },
    "btc": {
      "name": "btc",
      "description": "bitcoin price",
      "Open": 20362,
      "Close": 20156.7,
      "Low": 19591.8,
      "High": 20362.6,
      "200MA": 19705.251,
      "AboveMA": 1,
      "AboveMADays": 57,
      "RSI": 28.221721419750068
    },
    "RUB": {
      "name": "btc",
      "description": "ruble quote",
      "Open": 75.845,
      "Close": 76.1,
      "Low": 75.795,
      "High": 76.1023,
      "200MA": 63.27836249999999,
      "AboveMA": 1,
      "AboveMADays": 57,
      "RSI": 69.01636744101422
    },
    "BR": {
      "name": "btc",
      "description": "brent oil price",
      "Open": 80.96,
      "Close": 82.16,
      "Low": 80.25,
      "High": 82.49,
      "200MA": 92.12109999999998,
      "AboveMA": 0,
      "AboveMADays": 137,
      "RSI": 45.9465011481797
    }
  },
  "views": null,
  "msg_id": 903,
  "forwards": null,
  "outgoing": false,
  "media": "None",
  "reactions": [],
  "edit_date": null,
  "mentioned": false,
  "scheduled": false,
  "from_scheduled": false,
  "hashtags": [],
  "entities": [
    {
      "type": "MessageEntityType.ITALIC",
      "offset": 0,
      "length": 80
    }
  ],
  "mentions": [],
  "tg_urls": [],
  "symbols": 80,
  "words": 12,
  "new_timestamp": 1678429242,
  "outlier": 0
},
{
  "_id": {
    "$oid": "678c332086ed4bbab4874726"
  },
  "text": "This message couldn't be displayed on your device due to copyright infringement.",
  "timestamp": 1678166323,
  "posted_str_date": "03/07/2023",
  "forward_from_user_username": null,
  "forward_from_chat_username": null,
  "posted": {
    "$date": "2023-03-07T12:18:43.000Z"
  },
  "market_entities": {
    "dxy": {
      "name": "dxy",
      "description": "usd index",
      "Open": 104.3,
      "Close": 105.61,
      "Low": 104.12,
      "High": 105.65,
      "200MA": 106.57474999999998,
      "AboveMA": 0,
      "AboveMADays": 69,
      "RSI": 64.37575427250306
    },
    "gold": {
      "name": "gold",
      "description": "gold infinite future price",
      "Open": 1868.6,
      "Close": 1836.8,
      "Low": 1834.2,
      "High": 1873.4,
      "200MA": 1791.7495,
      "AboveMA": 1,
      "AboveMADays": 63,
      "RSI": 38.63585287790472
    },
    "btc": {
      "name": "btc",
      "description": "bitcoin price",
      "Open": 22410.1,
      "Close": 22197.8,
      "Low": 21968.6,
      "High": 22535.1,
      "200MA": 19714.4665,
      "AboveMA": 1,
      "AboveMADays": 54,
      "RSI": 41.66673459510202
    },
    "RUB": {
      "name": "btc",
      "description": "ruble quote",
      "Open": 75.445,
      "Close": 76.0225,
      "Low": 75.2405,
      "High": 76.1022,
      "200MA": 63.1784375,
      "AboveMA": 1,
      "AboveMADays": 55,
      "RSI": 69.62029281434297
    },
    "BR": {
      "name": "btc",
      "description": "brent oil price",
      "Open": 85.68,
      "Close": 82.8,
      "Low": 82.35,
      "High": 86.17,
      "200MA": 92.6277,
      "AboveMA": 0,
      "AboveMADays": 134,
      "RSI": 46.93663935609581
    }
  },
  "views": null,
  "msg_id": 902,
  "forwards": null,
  "outgoing": false,
  "media": "None",
  "reactions": [],
  "edit_date": null,
  "mentioned": false,
  "scheduled": false,
  "from_scheduled": false,
  "hashtags": [],
  "entities": [
    {
      "type": "MessageEntityType.ITALIC",
      "offset": 0,
      "length": 80
    }
  ],
  "mentions": [],
  "tg_urls": [],
  "symbols": 80,
  "words": 12,
  "new_timestamp": 1678166323,
  "outlier": 0
},
{
  "_id": {
    "$oid": "678c332086ed4bbab4874727"
  },
  "text": "This message couldn't be displayed on your device due to copyright infringement.",
  "timestamp": 1677925382,
  "posted_str_date": "03/04/2023",
  "forward_from_user_username": null,
  "forward_from_chat_username": null,
  "posted": {
    "$date": "2023-03-04T17:23:02.000Z"
  },
  "market_entities": {
    "dxy": {
      "name": "dxy",
      "description": "usd index",
      "Open": 104.94,
      "Close": 104.52,
      "Low": 104.49,
      "High": 105,
      "200MA": 106.54205,
      "AboveMA": 0,
      "AboveMADays": 67,
      "RSI": 56.24980440152908
    },
    "gold": {
      "name": "gold",
      "description": "gold infinite future price",
      "Open": 1858.9,
      "Close": 1871.4,
      "Low": 1858.9,
      "High": 1880.8,
      "200MA": 1791.803,
      "AboveMA": 1,
      "AboveMADays": 61,
      "RSI": 49.07881531573281
    },
    "btc": {
      "name": "btc",
      "description": "bitcoin price",
      "Open": 22354.7,
      "Close": 22347.1,
      "Low": 22167.4,
      "High": 22403.7,
      "200MA": 19716.1505,
      "AboveMA": 1,
      "AboveMADays": 51,
      "RSI": 42.84889352031357
    },
    "RUB": {
      "name": "btc",
      "description": "ruble quote",
      "Open": 75.3175,
      "Close": 75.6325,
      "Low": 75.3,
      "High": 75.75,
      "200MA": 63.00175,
      "AboveMA": 1,
      "AboveMADays": 53,
      "RSI": 68.70439278675943
    },
    "BR": {
      "name": "btc",
